show_id,type,title,country,released year,rating,listed_in,
s1,Movie,Dick Johnson Is Dead,United States,25-Sep-21,PG-13,Documentaries,
s2,TV Show,Blood & Water,South Africa,24-Sep-21,TV-MA,"International TV Shows, TV Dramas, TV Mysteries",
s3,TV Show,Ganglands,,24-Sep-21,TV-MA,"Crime TV Shows, International TV Shows, TV Action & Adventure",
s4,TV Show,Jailbirds New Orleans,,24-Sep-21,TV-MA,"Docuseries, Reality TV",
s5,TV Show,Kota Factory,India,24-Sep-21,TV-MA,"International TV Shows, Romantic TV Shows, TV Comedies",
s6,TV Show,Midnight Mass,,24-Sep-21,TV-MA,"TV Dramas, TV Horror, TV Mysteries",
s7,Movie,My Little Pony: A New Generation,,24-Sep-21,PG,Children & Family Movies,
s8,Movie,Sankofa,"United States, Ghana, Burkina Faso, United Kingdom, Germany, Ethiopia",24-Sep-21,TV-MA,"Dramas, Independent Movies, International Movies",
s9,TV Show,The Great British Baking Show,United Kingdom,24-Sep-21,TV-14,"British TV Shows, Reality TV",
s10,Movie,The Starling,United States,24-Sep-21,PG-13,"Comedies, Dramas",
s11,TV Show,"Vendetta: Truth, Lies and The Mafia",,24-Sep-21,TV-MA,"Crime TV Shows, Docuseries, International TV Shows",
s12,TV Show,Bangkok Breaking,,23-Sep-21,TV-MA,"Crime TV Shows, International TV Shows, TV Action & Adventure",
s13,Movie,Je Suis Karl,"Germany, Czech Republic",23-Sep-21,TV-MA,"Dramas, International Movies",
s14,Movie,Confessions of an Invisible Girl,,22-Sep-21,TV-PG,"Children & Family Movies, Comedies",
s15,TV Show,Crime Stories: India Detectives,,22-Sep-21,TV-MA,"British TV Shows, Crime TV Shows, Docuseries",
s16,TV Show,Dear White People,United States,22-Sep-21,TV-MA,"TV Comedies, TV Dramas",
s17,Movie,Europe's Most Dangerous Man: Otto Skorzeny in Spain,,22-Sep-21,TV-MA,"Documentaries, International Movies",
s18,TV Show,Falsa identidad,Mexico,22-Sep-21,TV-MA,"Crime TV Shows, Spanish-Language TV Shows, TV Dramas",
s19,Movie,Intrusion,,22-Sep-21,TV-14,Thrillers,
s20,TV Show,Jaguar,,22-Sep-21,TV-MA,"International TV Shows, Spanish-Language TV Shows, TV Action & Adventure",
s21,TV Show,Monsters Inside: The 24 Faces of Billy Milligan,,22-Sep-21,TV-14,"Crime TV Shows, Docuseries, International TV Shows",
s22,TV Show,Resurrection: Ertugrul,Turkey,22-Sep-21,TV-14,"International TV Shows, TV Action & Adventure, TV Dramas",
s23,Movie,Avvai Shanmughi,,21-Sep-21,TV-PG,"Comedies, International Movies",
s24,Movie,Go! Go! Cory Carson: Chrissy Takes the Wheel,,21-Sep-21,TV-Y,Children & Family Movies,
s25,Movie,Jeans,India,21-Sep-21,TV-14,"Comedies, International Movies, Romantic Movies",
s26,TV Show,Love on the Spectrum,Australia,21-Sep-21,TV-14,"Docuseries, International TV Shows, Reality TV",
s27,Movie,Minsara Kanavu,,21-Sep-21,TV-PG,"Comedies, International Movies, Music & Musicals",
s28,Movie,Grown Ups,United States,20-Sep-21,PG-13,Comedies,
s29,Movie,Dark Skies,United States,19-Sep-21,PG-13,"Horror Movies, Sci-Fi & Fantasy",
s30,Movie,Paranoia,"United States, India, France",19-Sep-21,PG-13,Thrillers,
s31,Movie,Ankahi Kahaniya,,17-Sep-21,TV-14,"Dramas, Independent Movies, International Movies",
s32,TV Show,Chicago Party Aunt,,17-Sep-21,TV-MA,TV Comedies,
s33,TV Show,Sex Education,United Kingdom,17-Sep-21,TV-MA,"British TV Shows, International TV Shows, TV Comedies",
s34,TV Show,Squid Game,,17-Sep-21,TV-MA,"International TV Shows, TV Dramas, TV Thrillers",
s35,TV Show,Tayo and Little Wizards,,17-Sep-21,TV-Y7,Kids' TV,
s36,Movie,The Father Who Moves Mountains,,17-Sep-21,TV-MA,"Dramas, International Movies, Thrillers",
s37,Movie,The Stronghold,,17-Sep-21,TV-MA,"Action & Adventure, Dramas, International Movies",
s38,TV Show,Angry Birds,Finland,16-Sep-21,TV-Y7,"Kids' TV, TV Comedies",
s39,Movie,Birth of the Dragon,"China, Canada, United States",16-Sep-21,PG-13,"Action & Adventure, Dramas",
s40,TV Show,Chhota Bheem,India,16-Sep-21,TV-Y7,Kids' TV,
s41,TV Show,He-Man and the Masters of the Universe,United States,16-Sep-21,TV-Y7,"Kids' TV, TV Sci-Fi & Fantasy",
s42,Movie,Jaws,United States,16-Sep-21,PG,"Action & Adventure, Classic Movies, Dramas",
s43,Movie,Jaws 2,United States,16-Sep-21,PG,"Dramas, Horror Movies, Thrillers",
s44,Movie,Jaws 3,United States,16-Sep-21,PG,"Action & Adventure, Horror Movies, Thrillers",
s45,Movie,Jaws: The Revenge,United States,16-Sep-21,PG-13,"Action & Adventure, Horror Movies, Thrillers",
s46,Movie,My Heroes Were Cowboys,,16-Sep-21,PG,Documentaries,
s47,Movie,Safe House,"South Africa, United States, Japan",16-Sep-21,R,Action & Adventure,
s48,TV Show,The Smart Money Woman,,16-Sep-21,TV-MA,"International TV Shows, Romantic TV Shows, TV Comedies",
s49,Movie,Training Day,United States,16-Sep-21,R,"Dramas, Thrillers",
s50,TV Show,Castle and Castle,Nigeria,15-Sep-21,TV-MA,"International TV Shows, TV Dramas",
s51,TV Show,Dharmakshetra,India,15-Sep-21,TV-PG,"International TV Shows, TV Dramas, TV Sci-Fi & Fantasy",
s52,Movie,InuYasha the Movie 2: The Castle Beyond the Looking Glass,Japan,15-Sep-21,TV-14,"Action & Adventure, Anime Features, International Movies",
s53,Movie,InuYasha the Movie 3: Swords of an Honorable Ruler,Japan,15-Sep-21,TV-14,"Action & Adventure, Anime Features, International Movies",
s54,Movie,InuYasha the Movie 4: Fire on the Mystic Island,Japan,15-Sep-21,TV-PG,"Action & Adventure, Anime Features, International Movies",
s55,Movie,InuYasha the Movie: Affections Touching Across Time,Japan,15-Sep-21,TV-PG,"Action & Adventure, Anime Features, International Movies",
s56,TV Show,Nailed It,United States,15-Sep-21,TV-PG,Reality TV,
s57,Movie,Naruto Shippuden the Movie: Blood Prison,Japan,15-Sep-21,TV-14,"Action & Adventure, Anime Features, International Movies",
s58,Movie,Naruto Shippûden the Movie: Bonds,Japan,15-Sep-21,TV-PG,"Action & Adventure, Anime Features, International Movies",
s59,Movie,Naruto Shippûden the Movie: The Will of Fire,Japan,15-Sep-21,TV-PG,"Action & Adventure, Anime Features, International Movies",
s60,Movie,Naruto Shippuden: The Movie,Japan,15-Sep-21,TV-PG,"Action & Adventure, Anime Features, International Movies",
s61,Movie,Naruto Shippuden: The Movie: The Lost Tower,Japan,15-Sep-21,TV-14,"Action & Adventure, Anime Features, International Movies",
s62,Movie,Naruto the Movie 2: Legend of the Stone of Gelel,Japan,15-Sep-21,TV-PG,"Action & Adventure, Anime Features, International Movies",
s63,Movie,Naruto the Movie 3: Guardians of the Crescent Moon Kingdom,Japan,15-Sep-21,TV-PG,"Action & Adventure, Anime Features, International Movies",
s64,Movie,Naruto the Movie: Ninja Clash in the Land of Snow,Japan,15-Sep-21,TV-PG,"Action & Adventure, Anime Features, International Movies",
s65,Movie,Nightbooks,,15-Sep-21,TV-PG,Children & Family Movies,
s66,TV Show,Numberblocks,United Kingdom,15-Sep-21,TV-Y,Kids' TV,
s67,TV Show,Raja Rasoi Aur Anya Kahaniyan,India,15-Sep-21,TV-G,"Docuseries, International TV Shows",
s68,TV Show,Saved by the Bell,United States,15-Sep-21,TV-PG,"Kids' TV, TV Comedies",
s69,Movie,Schumacher,,15-Sep-21,TV-14,"Documentaries, International Movies, Sports Movies",
s70,TV Show,Stories by Rabindranath Tagore,India,15-Sep-21,TV-PG,"International TV Shows, TV Dramas",
s71,TV Show,Too Hot To Handle: Latino,,15-Sep-21,TV-MA,"International TV Shows, Reality TV, Romantic TV Shows",
s72,Movie,A StoryBots Space Adventure,,14-Sep-21,TV-Y,Children & Family Movies,
s73,TV Show,Jack Whitehall: Travels with My Father,United Kingdom,14-Sep-21,TV-MA,"British TV Shows, Docuseries, International TV Shows",
s74,Movie,King of Boys,Nigeria,14-Sep-21,TV-MA,"Dramas, International Movies",
s75,TV Show,The World's Most Amazing Vacation Rentals,,14-Sep-21,TV-PG,Reality TV,
s76,Movie,You vs. Wild: Out Cold,,14-Sep-21,TV-G,Children & Family Movies,
s77,TV Show,Yowamushi Pedal,Japan,14-Sep-21,TV-14,"Anime Series, International TV Shows",
s78,Movie,Little Singham - Black Shadow,,11-Sep-21,TV-Y7,"Children & Family Movies, Comedies",
s79,Movie,Tughlaq Durbar,,11-Sep-21,TV-14,"Comedies, Dramas, International Movies",
s80,Movie,Tughlaq Durbar (Telugu),,11-Sep-21,TV-14,"Comedies, Dramas, International Movies",
s81,Movie,Firedrake the Silver Dragon,,10-Sep-21,TV-Y7,Children & Family Movies,
s82,Movie,Kate,United States,10-Sep-21,R,Action & Adventure,
s83,TV Show,Lucifer,United States,10-Sep-21,TV-14,"Crime TV Shows, TV Comedies, TV Dramas",
s84,TV Show,Metal Shop Masters,,10-Sep-21,TV-MA,Reality TV,
s85,Movie,Omo Ghetto: the Saga,Nigeria,10-Sep-21,TV-MA,"Action & Adventure, Comedies, Dramas",
s86,TV Show,Pokémon Master Journeys: The Series,,10-Sep-21,TV-Y7,"Anime Series, Kids' TV",
s87,Movie,Prey,,10-Sep-21,TV-MA,"International Movies, Thrillers",
s88,TV Show,Titipo Titipo,,10-Sep-21,TV-Y,"Kids' TV, Korean TV Shows",
s89,Movie,Blood Brothers: Malcolm X & Muhammad Ali,,9-Sep-21,PG-13,"Documentaries, Sports Movies",
s90,TV Show,Mighty Raju,,9-Sep-21,TV-Y7,Kids' TV,
s91,Movie,Paradise Hills,"Spain, United States",9-Sep-21,TV-MA,"Sci-Fi & Fantasy, Thrillers",
s92,Movie,The Women and the Murderer,France,9-Sep-21,TV-14,"Documentaries, International Movies",
s93,TV Show,Into the Night,Belgium,8-Sep-21,TV-MA,"International TV Shows, TV Dramas, TV Mysteries",
s94,Movie,JJ+E,,8-Sep-21,TV-MA,"Dramas, International Movies, Romantic Movies",
s95,Movie,Show Dogs,"United Kingdom, United States",8-Sep-21,PG,"Children & Family Movies, Comedies",
s96,TV Show,The Circle,"United States, United Kingdom",8-Sep-21,TV-MA,Reality TV,
s97,Movie,If I Leave Here Tomorrow: A Film About Lynyrd Skynyrd,United States,7-Sep-21,TV-MA,"Documentaries, Music & Musicals",
s98,TV Show,Kid Cosmic,United States,7-Sep-21,TV-Y7,"Kids' TV, TV Comedies, TV Sci-Fi & Fantasy",
s99,TV Show,Octonauts: Above & Beyond,United Kingdom,7-Sep-21,TV-Y,"British TV Shows, Kids' TV",
s100,TV Show,On the Verge,"France, United States",7-Sep-21,TV-MA,"TV Comedies, TV Dramas",
s101,TV Show,Tobot Galaxy Detectives,,7-Sep-21,TV-Y7,Kids' TV,
s102,Movie,Untold: Breaking Point,United States,7-Sep-21,TV-MA,"Documentaries, Sports Movies",
s103,TV Show,Countdown: Inspiration4 Mission to Space,,6-Sep-21,TV-14,"Docuseries, Science & Nature TV",
s104,Movie,Shadow Parties,,6-Sep-21,TV-MA,"Dramas, International Movies, Thrillers",
s105,TV Show,Tayo the Little Bus,South Korea,6-Sep-21,TV-Y,"Kids' TV, Korean TV Shows",
s106,Movie,Angamaly Diaries,India,5-Sep-21,TV-14,"Action & Adventure, Comedies, Dramas",
s107,TV Show,Bunk'd,United States,5-Sep-21,TV-G,"Kids' TV, TV Comedies",
s108,Movie,A Champion Heart,United States,4-Sep-21,G,"Children & Family Movies, Dramas",
s109,TV Show,Dive Club,Australia,3-Sep-21,TV-G,"Kids' TV, TV Dramas, Teen TV Shows",
s110,TV Show,La casa de papel,Spain,3-Sep-21,TV-MA,"Crime TV Shows, International TV Shows, Spanish-Language TV Shows",
s111,TV Show,Money Heist: From Tokyo to Berlin,,3-Sep-21,TV-MA,"Docuseries, International TV Shows, Spanish-Language TV Shows",
s112,TV Show,Sharkdog,"United States, Singapore",3-Sep-21,TV-Y,Kids' TV,
s113,Movie,Worth,,3-Sep-21,PG-13,Dramas,
s114,Movie,Afterlife of the Party,,2-Sep-21,TV-PG,"Comedies, Romantic Movies",
s115,Movie,Anjaam,India,2-Sep-21,TV-14,"Dramas, International Movies, Thrillers",
s116,Movie,Bright Star,"United Kingdom, Australia, France",2-Sep-21,PG,"Dramas, Romantic Movies",
s117,Movie,Dhanak,India,2-Sep-21,TV-PG,"Comedies, Dramas, Independent Movies",
s118,Movie,Final Account,"United Kingdom, United States",2-Sep-21,PG-13,Documentaries,
s119,Movie,Gurgaon,India,2-Sep-21,TV-14,"Dramas, International Movies, Thrillers",
s120,Movie,Here and There,,2-Sep-21,TV-MA,"Dramas, International Movies, Romantic Movies",
s121,TV Show,Heroes of Goo Jit Zu,Australia,2-Sep-21,TV-Y7,"Kids' TV, TV Comedies",
s122,TV Show,Hotel Del Luna,,2-Sep-21,TV-14,"International TV Shows, Romantic TV Shows, TV Comedies",
s123,Movie,In the Cut,"United Kingdom, Australia, France, United States",2-Sep-21,R,Thrillers,
s124,TV Show,Luv Kushh,,2-Sep-21,TV-Y7,Kids' TV,
s125,TV Show,Pororo - The Little Penguin,South Korea,2-Sep-21,TV-Y7,"Kids' TV, Korean TV Shows",
s126,TV Show,Q-Force,United States,2-Sep-21,TV-MA,"Crime TV Shows, TV Action & Adventure, TV Comedies",
s127,Movie,Shikara,India,2-Sep-21,TV-14,"Dramas, International Movies, Romantic Movies",
s128,Movie,A Cinderella Story,"United States, Canada",1-Sep-21,PG,"Children & Family Movies, Comedies",
s129,Movie,Agatha Christie's Crooked House,,1-Sep-21,PG-13,"Dramas, International Movies, Thrillers",
s130,Movie,An Unfinished Life,"Germany, United States",1-Sep-21,PG-13,Dramas,
s131,Movie,Barbie Big City Big Dreams,,1-Sep-21,TV-Y,"Children & Family Movies, Music & Musicals",
s132,Movie,Blade Runner: The Final Cut,United States,1-Sep-21,R,"Action & Adventure, Classic Movies, Cult Movies",
s133,TV Show,Brave Animated Series,,1-Sep-21,TV-MA,"International TV Shows, TV Action & Adventure, TV Comedies",
s134,Movie,Chappie,"South Africa, United States",1-Sep-21,R,"Action & Adventure, Sci-Fi & Fantasy",
s135,Movie,Clear and Present Danger,"United States, Mexico",1-Sep-21,PG-13,"Action & Adventure, Dramas",
s136,Movie,Cliffhanger,"United States, Italy, France, Japan",1-Sep-21,R,Action & Adventure,
s137,Movie,Cold Mountain,"United States, Italy, Romania, United Kingdom",1-Sep-21,R,"Dramas, Romantic Movies",
s138,Movie,Crocodile Dundee in Los Angeles,"Australia, United States",1-Sep-21,PG,"Action & Adventure, Comedies",
s139,Movie,Dear John,United States,1-Sep-21,PG-13,"Dramas, Romantic Movies",
s140,Movie,Do the Right Thing,United States,1-Sep-21,R,"Classic Movies, Comedies, Dramas",
s141,Movie,"El patrón, radiografía de un crimen","Argentina, Venezuela",1-Sep-21,TV-MA,"Dramas, International Movies, Thrillers",
s142,Movie,Extraction,"United States, United Kingdom, Canada",1-Sep-21,R,Action & Adventure,
s143,Movie,Freedom Writers,"Germany, United States",1-Sep-21,PG-13,Dramas,
s144,Movie,Green Lantern,United States,1-Sep-21,PG-13,"Action & Adventure, Sci-Fi & Fantasy",
s145,Movie,House Party,United States,1-Sep-21,R,"Comedies, Cult Movies",
s146,Movie,House Party 2,United States,1-Sep-21,R,"Comedies, Cult Movies, Music & Musicals",
s147,Movie,House Party 3,United States,1-Sep-21,R,"Comedies, Music & Musicals",
s148,TV Show,How to Be a Cowboy,,1-Sep-21,TV-PG,Reality TV,
s149,TV Show,HQ Barbers,,1-Sep-21,TV-14,TV Shows,
s150,Movie,I Got the Hook Up,United States,1-Sep-21,R,"Action & Adventure, Comedies",
s151,Movie,In Too Deep,United States,1-Sep-21,R,Thrillers,
s152,Movie,Initial D,"China, Hong Kong",1-Sep-21,TV-14,"Action & Adventure, International Movies",
s153,Movie,Janoskians: Untold and Untrue,United States,1-Sep-21,TV-MA,Comedies,
s154,TV Show,Kid-E-Cats,Russia,1-Sep-21,TV-Y,Kids' TV,
s155,TV Show,Kuroko's Basketball,Japan,1-Sep-21,TV-MA,"Anime Series, International TV Shows, Teen TV Shows",
s156,Movie,Labyrinth,"United Kingdom, United States",1-Sep-21,PG,"Action & Adventure, Children & Family Movies, Cult Movies",
s157,Movie,Letters to Juliet,United States,1-Sep-21,PG,"Comedies, Dramas, Romantic Movies",
s158,Movie,Level 16,Canada,1-Sep-21,TV-14,"Sci-Fi & Fantasy, Thrillers",
s159,Movie,Love Don't Cost a Thing,United States,1-Sep-21,PG-13,"Comedies, Romantic Movies",
s160,Movie,Love in a Puff,Hong Kong,1-Sep-21,TV-MA,"Comedies, Dramas, International Movies",
s161,TV Show,Major Dad,United States,1-Sep-21,TV-PG,TV Comedies,
s162,Movie,Mars Attacks!,United States,1-Sep-21,PG-13,"Comedies, Cult Movies, Sci-Fi & Fantasy",
s163,Movie,Marshall,"United States, China, Hong Kong",1-Sep-21,PG-13,Dramas,
s164,Movie,My Boss's Daughter,United States,1-Sep-21,R,"Comedies, Romantic Movies",
s165,Movie,Mystery Men,United States,1-Sep-21,PG-13,"Action & Adventure, Comedies",
s166,TV Show,Oldsters,,1-Sep-21,TV-MA,"Crime TV Shows, International TV Shows, Spanish-Language TV Shows",
s167,Movie,Once Upon a Time in America,"Italy, United States",1-Sep-21,R,"Classic Movies, Dramas",
s168,Movie,Open Season 2,"United States, Canada",1-Sep-21,PG,"Children & Family Movies, Comedies",
s169,Movie,Osmosis Jones,United States,1-Sep-21,PG,"Action & Adventure, Children & Family Movies, Comedies",
s170,Movie,Poseidon,United States,1-Sep-21,PG-13,"Action & Adventure, Dramas",
s171,Movie,Rhyme & Reason,United States,1-Sep-21,R,"Documentaries, Music & Musicals",
s172,Movie,Same Kind of Different as Me,United States,1-Sep-21,PG-13,"Dramas, Faith & Spirituality",
s173,Movie,School of Rock,"United States, Germany",1-Sep-21,PG-13,"Comedies, Music & Musicals",
s174,Movie,Snervous Tyler Oakley,United States,1-Sep-21,PG-13,"Documentaries, LGBTQ Movies",
s175,Movie,Tears of the Sun,United States,1-Sep-21,R,"Action & Adventure, Dramas",
s176,Movie,The Blue Lagoon,United States,1-Sep-21,R,"Dramas, Romantic Movies",
s177,Movie,The Golden Child,United States,1-Sep-21,PG-13,"Action & Adventure, Comedies",
s178,Movie,The Guns of Navarone,"United Kingdom, United States",1-Sep-21,TV-14,"Action & Adventure, Classic Movies",
s179,Movie,The Interview,United States,1-Sep-21,R,"Action & Adventure, Comedies",
s180,Movie,The Nutty Professor,United States,1-Sep-21,PG-13,"Comedies, Romantic Movies",
s181,Movie,The Nutty Professor II: The Klumps,,1-Sep-21,PG-13,"Comedies, Romantic Movies",
s182,TV Show,Turning Point: 9/11 and the War on Terror,,1-Sep-21,TV-14,Docuseries,
s183,Movie,Welcome Home Roscoe Jenkins,United States,1-Sep-21,PG-13,Comedies,
s184,Movie,In the Line of Fire,United States,31-Aug-21,R,"Action & Adventure, Classic Movies",
s185,TV Show,Sparking Joy,United States,31-Aug-21,TV-PG,Reality TV,
s186,Movie,Untold: Crime & Penalties,,31-Aug-21,TV-MA,"Documentaries, Sports Movies",
s187,TV Show,Hometown Cha-Cha-Cha,,29-Aug-21,TV-14,"International TV Shows, Romantic TV Shows, TV Comedies",
s188,TV Show,The Ingenuity of the Househusband,,29-Aug-21,TV-G,"International TV Shows, TV Comedies",
s189,Movie,2 Alone in Paris,France,28-Aug-21,TV-MA,"Comedies, International Movies",
s190,TV Show,Bread Barbershop,,28-Aug-21,TV-Y,"Kids' TV, TV Comedies",
s191,Movie,Thimmarusu,India,28-Aug-21,TV-14,"Dramas, International Movies",
s192,Movie,Wind River,"United Kingdom, Canada, United States",28-Aug-21,R,"Dramas, Independent Movies",
s193,Movie,C Kkompany,India,27-Aug-21,TV-14,"Action & Adventure, Comedies, International Movies",
s194,TV Show,D.P.,", South Korea",27-Aug-21,TV-MA,"International TV Shows, TV Dramas",
s195,TV Show,Deadly Sins,,27-Aug-21,TV-MA,"International TV Shows, Spanish-Language TV Shows, TV Dramas",
s196,Movie,EMI: Liya Hai To Chukana Padega,India,27-Aug-21,TV-14,"Comedies, Dramas, International Movies",
s197,Movie,He's All That,,27-Aug-21,TV-14,"Comedies, Romantic Movies",
s198,TV Show,I Heart Arlo,,27-Aug-21,TV-Y7,"Kids' TV, TV Comedies",
s199,TV Show,King of Boys: The Return of the King,Nigeria,27-Aug-21,TV-MA,"Crime TV Shows, International TV Shows, TV Dramas",
s200,Movie,Koi Aap Sa,India,27-Aug-21,TV-14,"Comedies, Dramas, International Movies",
s201,Movie,Krishna Cottage,India,27-Aug-21,TV-14,"Action & Adventure, Horror Movies, International Movies",
s202,Movie,Kucch To Hai,India,27-Aug-21,TV-14,"Dramas, International Movies, Thrillers",
s203,Movie,Kyaa Kool Hai Hum,India,27-Aug-21,TV-MA,"Comedies, International Movies, Music & Musicals",
s204,Movie,Kyaa Kool Hain Hum 3,India,27-Aug-21,TV-MA,"Comedies, International Movies",
s205,Movie,Kyaa Super Kool Hain Hum,India,27-Aug-21,TV-MA,"Comedies, International Movies",
s206,Movie,Kyo Kii... Main Jhuth Nahin Bolta,India,27-Aug-21,TV-14,"Comedies, International Movies, Sci-Fi & Fantasy",
s207,Movie,"LSD: Love, Sex Aur Dhokha",India,27-Aug-21,TV-MA,"Dramas, Independent Movies, International Movies",
s208,Movie,Mission Istaanbul: Darr Ke Aagey Jeet Hai,India,27-Aug-21,TV-14,"Action & Adventure, International Movies, Music & Musicals",
s209,Movie,Once Upon a Time in Mumbaai,India,27-Aug-21,TV-14,"Dramas, International Movies, Music & Musicals",
s210,Movie,Once Upon a Time in Mumbai Dobaara!,India,27-Aug-21,TV-14,"Dramas, International Movies, Music & Musicals",
s211,Movie,Ragini MMS,India,27-Aug-21,TV-MA,"Horror Movies, International Movies",
s212,Movie,Ragini MMS 2,India,27-Aug-21,TV-MA,"Horror Movies, International Movies",
s213,TV Show,Rebellion,Ireland,27-Aug-21,TV-MA,"International TV Shows, TV Dramas",
s214,TV Show,RIDE ON TIME,,27-Aug-21,TV-PG,"Docuseries, International TV Shows",
s215,Movie,SAS: Rise of the Black Swan,,27-Aug-21,R,"Action & Adventure, International Movies",
s216,Movie,Shootout at Lokhandwala,India,27-Aug-21,TV-MA,"Action & Adventure, Dramas, International Movies",
s217,Movie,Shor In the City,India,27-Aug-21,TV-14,"Comedies, Dramas, Independent Movies",
s218,Movie,The Dirty Picture,India,27-Aug-21,TV-14,"Comedies, Dramas, International Movies",
s219,TV Show,Titletown High,,27-Aug-21,TV-14,"Reality TV, Teen TV Shows",
s220,TV Show,EDENS ZERO,Japan,26-Aug-21,TV-14,"Anime Series, International TV Shows",
s221,TV Show,Family Reunion,United States,26-Aug-21,TV-PG,"Kids' TV, TV Comedies",
s222,Movie,"Bob Ross: Happy Accidents, Betrayal & Greed",,25-Aug-21,TV-14,Documentaries,
s223,TV Show,Clickbait,,25-Aug-21,TV-MA,"Crime TV Shows, TV Dramas, TV Mysteries",
s224,TV Show,John of God: The Crimes of a Spiritual Healer,,25-Aug-21,TV-MA,"Crime TV Shows, Docuseries, International TV Shows",
s225,TV Show,Motel Makeover,,25-Aug-21,TV-14,"International TV Shows, Reality TV",
s226,TV Show,Open Your Eyes,,25-Aug-21,TV-MA,"International TV Shows, TV Dramas, TV Mysteries",
s227,TV Show,Post Mortem: No One Dies in Skarnes,,25-Aug-21,TV-MA,"International TV Shows, TV Comedies, TV Dramas",
s228,Movie,Really Love,United States,25-Aug-21,TV-MA,"Dramas, Independent Movies, Romantic Movies",
s229,Movie,The November Man,"United States, United Kingdom",25-Aug-21,R,Action & Adventure,
s230,Movie,The Old Ways,United States,25-Aug-21,TV-MA,Horror Movies,
s231,Movie,The River Runner,,25-Aug-21,TV-MA,"Documentaries, Sports Movies",
s232,Movie,The Water Man,United States,25-Aug-21,PG,"Children & Family Movies, Dramas",
s233,TV Show,Wheel of Fortune,United States,25-Aug-21,TV-G,Reality TV,
s234,Movie,Count Me In,United Kingdom,24-Aug-21,TV-MA,"Documentaries, Music & Musicals",
s235,TV Show,Oggy Oggy,,24-Aug-21,TV-Y,"Kids' TV, TV Comedies",
s236,Movie,Untold: Caitlyn Jenner,,24-Aug-21,TV-PG,"Documentaries, LGBTQ Movies, Sports Movies",
s237,Movie,Boomika,,23-Aug-21,TV-14,"Horror Movies, International Movies, Thrillers",
s238,Movie,Boomika (Hindi),,23-Aug-21,TV-14,"Horror Movies, International Movies, Thrillers",
s239,Movie,Boomika (Malayalam),,23-Aug-21,TV-14,"Horror Movies, International Movies, Thrillers",
s240,Movie,Boomika (Telugu),,23-Aug-21,TV-14,"Horror Movies, International Movies, Thrillers",
s241,Movie,The Witcher: Nightmare of the Wolf,,23-Aug-21,TV-MA,"Action & Adventure, Anime Features",
s242,TV Show,Manifest,United States,21-Aug-21,TV-14,"TV Dramas, TV Mysteries, TV Sci-Fi & Fantasy",
s243,TV Show,Comedy Premium League,,20-Aug-21,TV-MA,"International TV Shows, TV Comedies",
s244,TV Show,Everything Will Be Fine,,20-Aug-21,TV-MA,"International TV Shows, Spanish-Language TV Shows, TV Comedies",
s245,Movie,Gunshot,,20-Aug-21,TV-14,"Dramas, International Movies, Thrillers",
s246,TV Show,Korean Cold Noodle Rhapsody,,20-Aug-21,TV-PG,"Docuseries, International TV Shows",
s247,Movie,Man in Love,,20-Aug-21,TV-MA,"Dramas, International Movies, Romantic Movies",
s248,Movie,Sweet Girl,United States,20-Aug-21,R,"Action & Adventure, Dramas",
s249,TV Show,The Chair,,20-Aug-21,TV-MA,"TV Comedies, TV Dramas",
s250,Movie,The Loud House Movie,,20-Aug-21,TV-Y7,"Children & Family Movies, Comedies, Music & Musicals",
s251,Movie,A Faraway Land,,19-Aug-21,TV-PG,"Dramas, International Movies, Romantic Movies",
s252,Movie,Like Crazy,United States,19-Aug-21,PG-13,"Dramas, Independent Movies, Romantic Movies",
s253,Movie,Black Island,,18-Aug-21,TV-MA,"International Movies, Thrillers",
s254,Movie,Bombay,India,18-Aug-21,TV-14,"Dramas, International Movies, Romantic Movies",
s255,TV Show,Go! Go! Cory Carson,United States,18-Aug-21,TV-Y,Kids' TV,
s256,Movie,Memories of a Murderer: The Nilsen Tapes,,18-Aug-21,TV-MA,"Documentaries, International Movies",
s257,Movie,Nneka The Pretty Serpent,,18-Aug-21,TV-14,"Dramas, International Movies",
s258,Movie,O Kadhal Kanmani,,18-Aug-21,TV-14,"Dramas, International Movies, Romantic Movies",
s259,Movie,Out of my league,,18-Aug-21,TV-MA,"Comedies, Dramas, International Movies",
s260,Movie,Pahuna,"India, Nepal",18-Aug-21,TV-PG,"Comedies, Dramas, International Movies",
s261,TV Show,The Defeated,,18-Aug-21,TV-MA,"Crime TV Shows, International TV Shows, TV Dramas",
s262,Movie,The Secret Diary of an Exchange Student,,18-Aug-21,TV-14,"Comedies, International Movies, Romantic Movies",
s263,Movie,Untold: Deal With the Devil,,18-Aug-21,TV-MA,"Documentaries, LGBTQ Movies, Sports Movies",
s264,TV Show,Mother Goose Club,United States,16-Aug-21,TV-Y,Kids' TV,
s265,Movie,Walk of Shame,United States,16-Aug-21,R,"Comedies, Independent Movies",
s266,TV Show,Rascal Does Not Dream of Bunny Girl Senpai,Japan,15-Aug-21,TV-14,"Anime Series, International TV Shows, Romantic TV Shows",
s267,TV Show,The Creative Indians,India,15-Aug-21,TV-MA,"Docuseries, International TV Shows",
s268,Movie,The Piano,"New Zealand, Australia, France, United States",15-Aug-21,R,"Classic Movies, Dramas, Independent Movies",
s269,Movie,Unroyal,,15-Aug-21,TV-MA,"Dramas, International Movies",
s270,TV Show,Winx Club,Italy,15-Aug-21,TV-Y7,Kids' TV,
s271,Movie,Beckett,"Italy, Brazil, Greece",13-Aug-21,TV-MA,Action & Adventure,
s272,TV Show,Brand New Cherry Flavor,United States,13-Aug-21,TV-MA,"TV Dramas, TV Horror, TV Mysteries",
s273,TV Show,Fast & Furious Spy Racers,United States,13-Aug-21,TV-Y7,Kids' TV,
s274,TV Show,Gone for Good,France,13-Aug-21,TV-MA,"Crime TV Shows, International TV Shows, TV Dramas",
s275,TV Show,Grace and Frankie,United States,13-Aug-21,TV-MA,"TV Comedies, TV Dramas",
