show_id,type,title,country,released year,rating,listed_in,
s2170,Movie,Sam Jay: 3 In The Morning,United States,4-Aug-20,TV-MA,Stand-Up Comedy,
s2171,TV Show,Immigration Nation,United States,3-Aug-20,TV-MA,Docuseries,
s2172,Movie,Almost Love,United States,2-Aug-20,TV-MA,"Comedies, Dramas, Independent Movies",
s2173,Movie,Killing Hasselhoff,United States,1-Aug-20,R,Comedies,
s2174,TV Show,Moesha,United States,1-Aug-20,TV-PG,"TV Comedies, Teen TV Shows",
s2175,TV Show,My Perfect Landing,Canada,1-Aug-20,TV-G,Kids' TV,
s2176,TV Show,Nagi-Asu: A Lull in the Sea,Japan,1-Aug-20,TV-14,"Anime Series, Romantic TV Shows, Teen TV Shows",
s2177,Movie,Rogue Warfare: The Hunt,United States,1-Aug-20,R,Action & Adventure,
s2178,Movie,Super Monsters: The New Class,Canada,1-Aug-20,TV-Y,Children & Family Movies,
s2179,TV Show,The Next Step,Canada,1-Aug-20,TV-G,"Kids' TV, Reality TV, TV Dramas",
s2180,Movie,The Ottoman Lieutenant,"Turkey, United States",1-Aug-20,R,"Dramas, Romantic Movies",
s2181,TV Show,Toradora!,Japan,1-Aug-20,TV-14,"Anime Series, International TV Shows, Romantic TV Shows",
s2182,TV Show,Transformers Rescue Bots Academy,United States,1-Aug-20,TV-Y,Kids' TV,
s2183,Movie,Tumi or not Tumi,,1-Aug-20,TV-MA,Stand-Up Comedy,
s2184,Movie,What Keeps You Alive,Canada,1-Aug-20,R,"LGBTQ Movies, Thrillers",
s2185,TV Show,Get Even,United Kingdom,31-Jul-20,TV-PG,"British TV Shows, Crime TV Shows, International TV Shows",
s2186,Movie,Latte and the Magic Waterstone,Germany,31-Jul-20,TV-Y,"Children & Family Movies, Comedies",
s2187,Movie,Raat Akeli Hai,India,31-Jul-20,TV-MA,"Dramas, International Movies, Thrillers",
s2188,Movie,Seriously Single,South Africa,31-Jul-20,TV-MA,"Comedies, International Movies, Romantic Movies",
s2189,Movie,Sugar High,United States,31-Jul-20,TV-G,Children & Family Movies,
s2190,TV Show,Sugar Rush,United States,31-Jul-20,TV-PG,Reality TV,
s2191,TV Show,The Umbrella Academy,"United States, Canada",31-Jul-20,TV-14,"TV Action & Adventure, TV Mysteries, TV Sci-Fi & Fantasy",
s2192,Movie,Retablo,"Peru, Germany, Norway",30-Jul-20,TV-MA,"Dramas, International Movies",
s2193,TV Show,Transformers: War For Cybertron Trilogy,United States,30-Jul-20,TV-Y7,Anime Series,
s2194,Movie,Uma Maheswara Ugra Roopasya,India,30-Jul-20,TV-MA,"Comedies, Dramas, Independent Movies",
s2195,TV Show,Unlucky Ploy,,30-Jul-20,TV-MA,"International TV Shows, Romantic TV Shows, TV Comedies",
s2196,Movie,It's Her Day,Nigeria,29-Jul-20,TV-MA,"Comedies, International Movies, Romantic Movies",
s2197,Movie,Redemption,Mozambique,29-Jul-20,TV-MA,"Dramas, International Movies, Thrillers",
s2198,Movie,Shine Your Eyes,"Brazil, France",29-Jul-20,TV-MA,"Dramas, Independent Movies, International Movies",
s2199,Movie,The Hater,Poland,29-Jul-20,TV-MA,"Dramas, International Movies, Thrillers",
s2200,Movie,The Speed Cubers,United States,29-Jul-20,TV-PG,Documentaries,
s2201,Movie,Tread,United States,29-Jul-20,TV-MA,Documentaries,
s2202,TV Show,Last Chance U,United States,28-Jul-20,TV-MA,Docuseries,
s2203,Movie,Banana Split,United States,26-Jul-20,TV-MA,"Comedies, Dramas, Independent Movies",
s2204,TV Show,Shameless (U.S.),United States,26-Jul-20,TV-MA,"TV Comedies, TV Dramas",
s2205,Movie,Door Ke Darshan,India,25-Jul-20,TV-14,"Comedies, International Movies",
s2206,Movie,Double World,China,25-Jul-20,TV-14,"Action & Adventure, International Movies",
s2207,Movie,Project Marathwada,India,25-Jul-20,TV-MA,"Dramas, Independent Movies, International Movies",
s2208,Movie,Animal Crackers,"China, Spain, South Korea, United States",24-Jul-20,TV-Y7,"Children & Family Movies, Comedies",
s2209,Movie,Dragons: Rescue Riders: Secrets of the Songwing,United States,24-Jul-20,TV-Y,"Children & Family Movies, Comedies",
s2210,Movie,Nimbe,Nigeria,24-Jul-20,TV-MA,"Dramas, International Movies",
s2211,Movie,Offering to the Storm,"Spain, Germany",24-Jul-20,TV-MA,"International Movies, Thrillers",
s2212,Movie,Romance Doll,Japan,24-Jul-20,TV-MA,"Dramas, International Movies, Romantic Movies",
s2213,TV Show,Sing On! Spain,Spain,24-Jul-20,TV-G,"International TV Shows, Reality TV, Spanish-Language TV Shows",
s2214,Movie,The Kissing Booth 2,"United Kingdom, United States",24-Jul-20,TV-14,"Comedies, Romantic Movies",
s2215,TV Show,Sinatra: All or Nothing at All,United States,23-Jul-20,TV-14,Docuseries,
s2216,Movie,The Larva Island Movie,South Korea,23-Jul-20,TV-Y7,"Children & Family Movies, Comedies",
s2217,Movie,The Letter Reader,South Africa,23-Jul-20,TV-PG,"Dramas, International Movies",
s2218,TV Show,Fear City: New York vs The Mafia,United States,22-Jul-20,TV-MA,"Crime TV Shows, Docuseries",
s2219,TV Show,Norsemen,Norway,22-Jul-20,TV-MA,"International TV Shows, TV Comedies",
s2220,Movie,The Remix: Hip Hop X Fashion,United States,22-Jul-20,TV-MA,"Documentaries, Music & Musicals",
s2221,Movie,Ip Man 4: The Finale,"Hong Kong, China",21-Jul-20,TV-MA,"Action & Adventure, Dramas, International Movies",
s2222,Movie,Jack Whitehall: I'm Only Joking,United Kingdom,21-Jul-20,TV-MA,Stand-Up Comedy,
s2223,TV Show,Street Food: Latin America,,21-Jul-20,TV-PG,"Docuseries, Spanish-Language TV Shows",
s2224,TV Show,Killer Women with Piers Morgan,United Kingdom,19-Jul-20,TV-MA,"British TV Shows, Crime TV Shows, Docuseries",
s2225,Movie,Funan,"France, Belgium, Luxembourg, Cambodia,",18-Jul-20,TV-14,"Dramas, International Movies",
s2226,TV Show,Gigantosaurus,France,18-Jul-20,TV-Y,Kids' TV,
s2227,TV Show,Single Wives,Australia,18-Jul-20,TV-MA,"Reality TV, Romantic TV Shows",
s2228,TV Show,Cursed,"United Kingdom, Australia",17-Jul-20,TV-MA,"TV Action & Adventure, TV Dramas, TV Sci-Fi & Fantasy",
s2229,Movie,Father Soldier Son,United States,17-Jul-20,R,Documentaries,
s2230,TV Show,In The Dark,United States,17-Jul-20,TV-14,"Crime TV Shows, TV Dramas",
s2231,TV Show,Kissing Game,Brazil,17-Jul-20,TV-MA,"International TV Shows, TV Dramas, TV Mysteries",
s2232,Movie,The Millions,Nigeria,17-Jul-20,TV-MA,"Comedies, International Movies",
s2233,Movie,Fatal Affair,United States,16-Jul-20,TV-14,Thrillers,
s2234,Movie,MILF,"France, Belgium",16-Jul-20,TV-MA,"Comedies, International Movies, Romantic Movies",
s2235,Movie,Cold Feet,Nigeria,15-Jul-20,TV-14,"Dramas, International Movies, Romantic Movies",
s2236,TV Show,Dark Desire,Mexico,15-Jul-20,TV-MA,"Crime TV Shows, International TV Shows, Spanish-Language TV Shows",
s2237,Movie,Little Singham: Legend of Dugabakka,,15-Jul-20,TV-Y7,"Children & Family Movies, Comedies",
s2238,TV Show,Skin Decision: Before and After,United States,15-Jul-20,TV-MA,"Reality TV, Science & Nature TV",
s2239,TV Show,Sunny Bunnies,Belarus,15-Jul-20,TV-Y,"British TV Shows, Kids' TV, TV Comedies",
s2240,Movie,Sylvia,Nigeria,15-Jul-20,TV-14,"Dramas, International Movies, Thrillers",
s2241,Movie,The Players,Italy,15-Jul-20,TV-MA,"Comedies, International Movies",
s2242,TV Show,The Business of Drugs,United States,14-Jul-20,TV-MA,Docuseries,
s2243,Movie,Urzila Carlson: Overqualified Loser,Australia,14-Jul-20,TV-MA,Stand-Up Comedy,
s2244,Movie,We Are One,France,14-Jul-20,TV-MA,"Documentaries, International Movies, Music & Musicals",
s2245,Movie,Hole in the Wall,South Africa,11-Jul-20,TV-MA,"Dramas, International Movies",
s2246,TV Show,Dating Around: Brazil,Brazil,10-Jul-20,TV-14,"International TV Shows, Reality TV, Romantic TV Shows",
s2247,TV Show,Down to Earth with Zac Efron,United States,10-Jul-20,TV-PG,"Docuseries, Reality TV, Science & Nature TV",
s2248,Movie,Mama's Boy,Egypt,10-Jul-20,TV-14,"Comedies, International Movies",
s2249,Movie,The Claudia Kishi Club,United States,10-Jul-20,TV-14,Documentaries,
s2250,TV Show,The Epic Tales of Captain Underpants in Space,United States,10-Jul-20,TV-Y7,"Kids' TV, TV Action & Adventure, TV Comedies",
s2251,Movie,The Old Guard,United States,10-Jul-20,R,Action & Adventure,
s2252,TV Show,The Twelve,Belgium,10-Jul-20,TV-MA,"Crime TV Shows, International TV Shows, TV Dramas",
s2253,Movie,Your Excellency,,10-Jul-20,TV-G,"Comedies, International Movies",
s2254,TV Show,Japan Sinks: 2020,Japan,9-Jul-20,TV-MA,"Anime Series, International TV Shows",
s2255,TV Show,The Protector,Turkey,9-Jul-20,TV-MA,"International TV Shows, Romantic TV Shows, TV Action & Adventure",
s2256,TV Show,Was It Love?,South Korea,9-Jul-20,TV-14,"International TV Shows, Korean TV Shows, Romantic TV Shows",
s2257,Movie,Born Racer,New Zealand,8-Jul-20,R,"Documentaries, Sports Movies",
s2258,Movie,Mucho Mucho Amor: The Legend of Walter Mercado,United States,8-Jul-20,TV-14,"Documentaries, LGBTQ Movies",
s2259,TV Show,Stateless,Australia,8-Jul-20,TV-MA,"International TV Shows, TV Dramas",
s2260,Movie,The Long Dumb Road,United States,8-Jul-20,R,"Comedies, Independent Movies",
s2261,Movie,Dr. Seuss' The Lorax,"United States, France",7-Jul-20,PG,Children & Family Movies,
s2262,Movie,Jim Jefferies: Intolerant,,7-Jul-20,TV-MA,Stand-Up Comedy,
s2263,Movie,A Kid from Coney Island,"United States, China",6-Jul-20,TV-MA,"Documentaries, Sports Movies",
s2264,Movie,PNL - Dans la légende tour,,6-Jul-20,TV-MA,"International Movies, Music & Musicals",
s2265,Movie,Aiyyaa,India,5-Jul-20,TV-14,"Comedies, International Movies, Music & Musicals",
s2266,Movie,Bbuddah Hoga Terra Baap,India,5-Jul-20,TV-14,"Action & Adventure, Comedies, Dramas",
s2267,Movie,Blood Money,India,5-Jul-20,TV-14,"Dramas, International Movies, Romantic Movies",
s2268,Movie,Bombay Talkies,India,5-Jul-20,TV-MA,"Dramas, International Movies",
s2269,Movie,Boss,India,5-Jul-20,TV-14,"Action & Adventure, Comedies, Dramas",
s2270,Movie,Budhia Singh: Born to Run,India,5-Jul-20,TV-MA,"Dramas, Independent Movies, International Movies",
s2271,Movie,Chashme Baddoor,India,5-Jul-20,TV-14,"Comedies, International Movies, Music & Musicals",
s2272,Movie,Dharam Sankat Mein,India,5-Jul-20,TV-PG,"Comedies, Dramas, International Movies",
s2273,Movie,Drishyam,India,5-Jul-20,TV-14,"Dramas, International Movies, Thrillers",
s2274,Movie,Gabbar Is Back,India,5-Jul-20,TV-14,"Action & Adventure, Dramas, International Movies",
s2275,Movie,Gollu Aur Pappu,India,5-Jul-20,TV-14,"Action & Adventure, Comedies, International Movies",
s2276,TV Show,Hook,Thailand,5-Jul-20,TV-MA,"International TV Shows, Romantic TV Shows, TV Comedies",
s2277,Movie,Inkaar,India,5-Jul-20,TV-MA,"Dramas, International Movies, Romantic Movies",
s2278,Movie,Madras Café,India,5-Jul-20,TV-14,"Dramas, International Movies, Thrillers",
s2279,Movie,Mary Kom,India,5-Jul-20,TV-PG,"Dramas, International Movies, Sports Movies",
s2280,Movie,Michael,India,5-Jul-20,TV-MA,"Dramas, Independent Movies, International Movies",
s2281,Movie,Mumbai Delhi Mumbai,India,5-Jul-20,TV-MA,"Comedies, International Movies, Romantic Movies",
s2282,Movie,Oh My God,India,5-Jul-20,TV-PG,"Comedies, Dramas, International Movies",
s2283,Movie,One by Two,India,5-Jul-20,TV-14,"Comedies, Dramas, International Movies",
s2284,Movie,Only,United States,5-Jul-20,TV-MA,"Dramas, Independent Movies, Romantic Movies",
s2285,Movie,Penalty,India,5-Jul-20,TV-14,"Dramas, Independent Movies, International Movies",
s2286,Movie,Players,India,5-Jul-20,TV-14,"Action & Adventure, International Movies",
s2287,Movie,Pyaar Ka Punchnama 2,India,5-Jul-20,TV-MA,"Comedies, Dramas, International Movies",
s2288,Movie,Queen,India,5-Jul-20,TV-MA,"Comedies, Dramas, International Movies",
s2289,Movie,Shaitan,India,5-Jul-20,TV-MA,"Action & Adventure, Dramas, Independent Movies",
s2290,Movie,Special 26,India,5-Jul-20,TV-PG,"Dramas, International Movies, Thrillers",
s2291,Movie,Tanu Weds Manu,India,5-Jul-20,TV-14,"Comedies, Dramas, International Movies",
s2292,Movie,What the Fish,India,5-Jul-20,TV-14,"Comedies, International Movies",
s2293,TV Show,Little Singham,India,4-Jul-20,TV-Y7,"Kids' TV, TV Comedies",
s2294,TV Show,Cable Girls,Spain,3-Jul-20,TV-MA,"International TV Shows, Romantic TV Shows, Spanish-Language TV Shows",
s2295,Movie,Desperados,United States,3-Jul-20,TV-MA,"Comedies, Romantic Movies",
s2296,Movie,Hunter in the Blue Side of Manchester,"Indonesia, United Kingdom",3-Jul-20,TV-MA,"Dramas, International Movies",
s2297,Movie,I Am Not Your Negro,"Switzerland, France, Belgium, United States",3-Jul-20,PG-13,Documentaries,
s2298,TV Show,JU-ON: Origins,Japan,3-Jul-20,TV-MA,"International TV Shows, TV Horror, TV Mysteries",
s2299,TV Show,Southern Survival,United States,3-Jul-20,TV-PG,Reality TV,
s2300,TV Show,The Baby-Sitters Club,United States,3-Jul-20,TV-G,"Kids' TV, TV Dramas",
s2301,Movie,The Perfect Picture: Ten Years Later,Ghana,3-Jul-20,TV-MA,"Comedies, Dramas, International Movies",
s2302,TV Show,Supermarket Sweep,United States,2-Jul-20,TV-G,Reality TV,
s2303,Movie,Thiago Ventura: POKAS,Brazil,2-Jul-20,TV-MA,Stand-Up Comedy,
s2304,TV Show,Warrior Nun,United States,2-Jul-20,TV-MA,"TV Action & Adventure, TV Mysteries, TV Sci-Fi & Fantasy",
s2305,Movie,#AnneFrank - Parallel Stories,Italy,1-Jul-20,TV-14,"Documentaries, International Movies",
s2306,TV Show,21 Again,United Kingdom,1-Jul-20,TV-MA,"British TV Shows, Reality TV",
s2307,TV Show,A Touch of Green,Taiwan,1-Jul-20,TV-MA,"International TV Shows, TV Dramas",
s2308,TV Show,Abby Hatcher,"United States, Canada",1-Jul-20,TV-Y,Kids' TV,
s2309,Movie,Adú,Spain,1-Jul-20,TV-MA,"Dramas, International Movies",
s2310,Movie,Ali Baba ve 7 Cüceler,Turkey,1-Jul-20,TV-MA,"Action & Adventure, Comedies, International Movies",
s2311,Movie,David Foster: Off the Record,Canada,1-Jul-20,TV-MA,"Documentaries, Music & Musicals",
s2312,Movie,Double Jeopardy,"United States, Germany, Canada",1-Jul-20,R,Thrillers,
s2313,Movie,Pek Yakında,Turkey,1-Jul-20,TV-MA,"Comedies, International Movies",
s2314,TV Show,Say I Do,United States,1-Jul-20,TV-14,"Reality TV, Romantic TV Shows",
s2315,Movie,Stardust,"United Kingdom, United States",1-Jul-20,PG-13,"Action & Adventure, International Movies, Romantic Movies",
s2316,Movie,The F**k-It List,United States,1-Jul-20,TV-MA,Comedies,
s2317,Movie,The Silence of Others,"Spain, France, Canada, United States",1-Jul-20,TV-14,"Documentaries, International Movies",
s2318,Movie,Total Recall,"United States, Mexico",1-Jul-20,R,"Action & Adventure, Sci-Fi & Fantasy",
s2319,TV Show,Trotro,France,1-Jul-20,TV-Y,Kids' TV,
s2320,Movie,Under the Riccione Sun,Italy,1-Jul-20,TV-MA,"Comedies, International Movies, Romantic Movies",
s2321,TV Show,BNA,Japan,30-Jun-20,TV-14,"Anime Series, International TV Shows",
s2322,Movie,George Lopez: We'll Do It For Half,United States,30-Jun-20,TV-MA,Stand-Up Comedy,
s2323,TV Show,Homemade,"Chile, Italy",30-Jun-20,TV-MA,"International TV Shows, TV Dramas",
s2324,Movie,The Mirror Boy,"United Kingdom, Nigeria",30-Jun-20,TV-14,"Action & Adventure, Dramas, International Movies",
s2325,Movie,#FriendButMarried 2,Indonesia,28-Jun-20,TV-G,"Dramas, International Movies, Romantic Movies",
s2326,Movie,Skin,Nigeria,28-Jun-20,TV-MA,"Documentaries, International Movies",
s2327,Movie,Thackeray (Marathi),,28-Jun-20,TV-14,"Dramas, International Movies",
s2328,TV Show,Dark,"Germany, United States",27-Jun-20,TV-MA,"Crime TV Shows, International TV Shows, TV Dramas",
s2329,Movie,Ride Like a Girl,Australia,27-Jun-20,PG,"Children & Family Movies, Dramas, Independent Movies",
s2330,TV Show,All For Love,Colombia,26-Jun-20,TV-MA,"International TV Shows, Romantic TV Shows, Spanish-Language TV Shows",
s2331,Movie,Eurovision Song Contest: The Story of Fire Saga,United States,26-Jun-20,PG-13,"Comedies, Music & Musicals, Romantic Movies",
s2332,TV Show,Home Game,United States,26-Jun-20,TV-MA,Docuseries,
s2333,Movie,Kasanova,Nigeria,26-Jun-20,TV-14,"Comedies, International Movies, Romantic Movies",
s2334,Movie,Ordinary People,Philippines,26-Jun-20,TV-MA,"Dramas, Independent Movies, International Movies",
s2335,Movie,Seven (Tamil),India,26-Jun-20,TV-MA,"Dramas, International Movies, Romantic Movies",
s2336,Movie,Seven (Telugu),,26-Jun-20,TV-14,"Dramas, International Movies, Romantic Movies",
s2337,Movie,Thackeray (Hindi),India,26-Jun-20,TV-14,"Dramas, International Movies",
s2338,TV Show,Twogether,South Korea,26-Jun-20,TV-G,"International TV Shows, Korean TV Shows, Reality TV",
s2339,Movie,Krishna and His Leela,India,25-Jun-20,TV-MA,"International Movies, Romantic Movies",
s2340,Movie,Prem Ratan Dhan Payo,India,25-Jun-20,TV-14,"Action & Adventure, Dramas, International Movies",
s2341,Movie,Vivah,India,25-Jun-20,TV-14,"Dramas, International Movies, Romantic Movies",
s2342,Movie,Athlete A,United States,24-Jun-20,PG-13,"Documentaries, Sports Movies",
s2343,Movie,Bulbbul,India,24-Jun-20,TV-MA,"Horror Movies, International Movies",
s2344,TV Show,Crazy Delicious,United Kingdom,24-Jun-20,TV-PG,"British TV Shows, International TV Shows, Reality TV",
s2345,Movie,Nobody Knows I'm Here,Chile,24-Jun-20,TV-MA,"Dramas, Independent Movies, International Movies",
s2346,Movie,Eric Andre: Legalize Everything,United States,23-Jun-20,TV-MA,Stand-Up Comedy,
s2347,TV Show,"Roswell, New Mexico",United States,23-Jun-20,TV-14,"Classic & Cult TV, TV Dramas, TV Sci-Fi & Fantasy",
s2348,Movie,Kappela,India,22-Jun-20,TV-14,"Dramas, Independent Movies, International Movies",
s2349,Movie,The Royal Hibiscus Hotel,Nigeria,22-Jun-20,TV-PG,"Comedies, International Movies, Romantic Movies",
s2350,TV Show,It's Okay to Not Be Okay,South Korea,21-Jun-20,TV-MA,"International TV Shows, Korean TV Shows, Romantic TV Shows",
s2351,Movie,Woodshock,United States,21-Jun-20,R,"Dramas, Independent Movies, Thrillers",
s2352,Movie,Elevator Baby,Nigeria,20-Jun-20,TV-MA,"Dramas, International Movies",
s2353,TV Show,Babies,United States,19-Jun-20,TV-14,"Docuseries, Science & Nature TV",
s2354,Movie,Chaman Bahaar,India,19-Jun-20,TV-MA,"Comedies, Dramas, International Movies",
s2355,Movie,Destiny,"France, Egypt",19-Jun-20,TV-14,"Dramas, International Movies",
s2356,Movie,Disclosure,United States,19-Jun-20,TV-MA,"Documentaries, LGBTQ Movies",
s2357,Movie,Feel the Beat,United States,19-Jun-20,TV-G,"Children & Family Movies, Comedies, Dramas",
s2358,TV Show,Floor Is Lava,United States,19-Jun-20,TV-PG,Reality TV,
s2359,Movie,Lost Bullet,France,19-Jun-20,TV-MA,"Action & Adventure, Dramas, International Movies",
s2360,TV Show,Most Beautiful Thing,Brazil,19-Jun-20,TV-MA,"International TV Shows, Romantic TV Shows, TV Dramas",
s2361,Movie,One-Way to Tomorrow,Turkey,19-Jun-20,TV-MA,"Dramas, International Movies, Romantic Movies",
s2362,Movie,The Emigrant,"Egypt, France",19-Jun-20,TV-14,"Dramas, International Movies",
s2363,TV Show,The Politician,United States,19-Jun-20,TV-MA,"TV Comedies, TV Dramas, Teen TV Shows",
s2364,Movie,Wasp Network,"France, Brazil, Spain, Belgium",19-Jun-20,TV-MA,"Dramas, International Movies, Thrillers",
s2365,Movie,A Whisker Away,Japan,18-Jun-20,TV-PG,"Anime Features, Children & Family Movies, International Movies",
s2366,Movie,Alexandria ... Why?,"Egypt, Algeria",18-Jun-20,TV-MA,"Classic Movies, Dramas, International Movies",
s2367,Movie,Alexandria: Again and Forever,"France, Egypt",18-Jun-20,TV-MA,"Classic Movies, Dramas, International Movies",
s2368,Movie,An Egyptian Story,Egypt,18-Jun-20,TV-MA,"Classic Movies, Dramas, Independent Movies",
s2369,Movie,Cairo Station,Egypt,18-Jun-20,TV-14,"Classic Movies, Dramas, International Movies",
s2370,Movie,Dark Waters,Egypt,18-Jun-20,TV-14,"Classic Movies, Dramas, International Movies",
s2371,Movie,El límite infinito,,18-Jun-20,TV-PG,"Documentaries, International Movies, Sports Movies",
s2372,Movie,Lola Igna,Philippines,18-Jun-20,TV-14,"Comedies, International Movies",
s2373,Movie,One Take,Thailand,18-Jun-20,TV-G,"Documentaries, International Movies, Music & Musicals",
s2374,Movie,Saladin,Egypt,18-Jun-20,TV-MA,"Action & Adventure, Classic Movies, Dramas",
s2375,Movie,Stray Bullet,Lebanon,18-Jun-20,TV-MA,"Dramas, International Movies, Romantic Movies",
s2376,Movie,The Blazing Sun,Egypt,18-Jun-20,TV-14,"Classic Movies, Dramas, International Movies",
s2377,Movie,The Land,Egypt,18-Jun-20,TV-MA,"Classic Movies, Dramas, International Movies",
s2378,Movie,The Nut Job,"Canada, South Korea, United States",18-Jun-20,PG,"Children & Family Movies, Comedies",
s2379,TV Show,The Order,United States,18-Jun-20,TV-MA,"International TV Shows, TV Dramas, TV Horror",
s2380,Movie,An Evening with Beverly Luff Linn,"United Kingdom, United States",17-Jun-20,R,"Comedies, Independent Movies",
s2381,Movie,Riding Faith,United States,17-Jun-20,TV-PG,"Children & Family Movies, Dramas, Faith & Spirituality",
s2382,Movie,Last Flight to Abuja,"Nigeria, United Kingdom",16-Jun-20,TV-14,"Dramas, International Movies",
s2383,Movie,The Darkness,United States,16-Jun-20,PG-13,"Horror Movies, Thrillers",
s2384,TV Show,The Chase,United States,15-Jun-20,TV-PG,Reality TV,
s2385,Movie,The Show Must Go On: The Queen + Adam Lambert Story,"United Kingdom, United States",15-Jun-20,TV-MA,"Documentaries, Music & Musicals",
s2386,Movie,Underdogs,"Argentina, Spain",15-Jun-20,PG,"Children & Family Movies, Sports Movies",
s2387,Movie,Wira,Malaysia,15-Jun-20,TV-14,"Action & Adventure, Dramas, International Movies",
s2388,Movie,4th Republic,Nigeria,13-Jun-20,TV-MA,"Dramas, International Movies, Thrillers",
s2389,TV Show,Alexa & Katie,United States,13-Jun-20,TV-G,"Kids' TV, TV Comedies",
s2390,Movie,Asura Guru,India,13-Jun-20,TV-14,"Dramas, International Movies",
s2391,TV Show,How to Get Away with Murder,United States,13-Jun-20,TV-14,"Crime TV Shows, TV Dramas, TV Mysteries",
s2392,Movie,Milea,Indonesia,13-Jun-20,TV-14,"Dramas, International Movies, Romantic Movies",
s2393,Movie,Axone,India,12-Jun-20,TV-MA,"Comedies, Dramas, Independent Movies",
s2394,Movie,Da 5 Bloods,United States,12-Jun-20,R,"Action & Adventure, Dramas",
s2395,TV Show,Dating Around,,12-Jun-20,TV-MA,"Reality TV, Romantic TV Shows",
s2396,TV Show,F is for Family,"United States, France, Canada",12-Jun-20,TV-MA,TV Comedies,
s2397,TV Show,Frank Elstner: Just One Last Question,Germany,12-Jun-20,TV-MA,"International TV Shows, Stand-Up Comedy & Talk Shows",
s2398,Movie,Jo Koy: In His Elements,United States,12-Jun-20,TV-MA,Stand-Up Comedy,
s2399,Movie,Okko's Inn,Japan,12-Jun-20,PG,"Anime Features, Children & Family Movies",
s2400,TV Show,ONE PIECE,Japan,12-Jun-20,TV-14,Anime Series,
s2401,TV Show,The Search,Mexico,12-Jun-20,TV-MA,"Crime TV Shows, International TV Shows, Spanish-Language TV Shows",
s2402,TV Show,The Woods,"Poland, United States",12-Jun-20,TV-MA,"Crime TV Shows, International TV Shows, TV Dramas",
s2403,Movie,From A to B,"United Arab Emirates, Jordan, Lebanon, Saudi Arabia",11-Jun-20,TV-MA,"Comedies, Dramas, International Movies",
s2404,Movie,Menahi,Saudi Arabia,11-Jun-20,TV-14,"Comedies, International Movies",
s2405,TV Show,Curon,Italy,10-Jun-20,TV-MA,"International TV Shows, TV Dramas, TV Horror",
s2406,TV Show,DC's Legends of Tomorrow,United States,10-Jun-20,TV-14,"TV Action & Adventure, TV Sci-Fi & Fantasy",
s2407,TV Show,Lenox Hill,United States,10-Jun-20,TV-MA,"Docuseries, Reality TV, Science & Nature TV",
s2408,Movie,Middle Men,United States,10-Jun-20,R,"Comedies, Dramas, Independent Movies",
s2409,TV Show,My Mister,South Korea,10-Jun-20,TV-MA,"Crime TV Shows, International TV Shows, Korean TV Shows",
s2410,TV Show,Reality Z,Brazil,10-Jun-20,TV-MA,"International TV Shows, TV Horror, TV Mysteries",
s2411,Movie,The Witch: Part 1 - The Subversion,South Korea,10-Jun-20,TV-MA,"Action & Adventure, International Movies, Sci-Fi & Fantasy",
s2412,Movie,Before I Fall,United States,8-Jun-20,PG-13,"Dramas, Romantic Movies",
s2413,Movie,365 Days,Poland,7-Jun-20,TV-MA,"Dramas, International Movies, Romantic Movies",
s2414,Movie,Forensic,India,7-Jun-20,TV-14,"International Movies, Thrillers",
s2415,Movie,Project Papa,India,7-Jun-20,TV-14,"Dramas, Independent Movies, International Movies",
s2416,TV Show,Queen of the South,"United States, Mexico, Spain, Malta",6-Jun-20,TV-MA,"Crime TV Shows, TV Action & Adventure, TV Dramas",
s2417,Movie,The Night Clerk,United States,6-Jun-20,R,"Dramas, Independent Movies",
s2418,TV Show,13 Reasons Why,United States,5-Jun-20,TV-MA,"Crime TV Shows, TV Dramas, TV Mysteries",
s2419,Movie,Before the Summer Crowds,Egypt,5-Jun-20,TV-14,"Dramas, International Movies",
s2420,Movie,Big Stone Gap,United States,5-Jun-20,PG-13,"Comedies, Romantic Movies",
s2421,Movie,Choked: Paisa Bolta Hai,India,5-Jun-20,TV-14,"Dramas, International Movies",
s2422,Movie,Merry Men 2: Another Mission,Nigeria,5-Jun-20,TV-MA,"Comedies, International Movies",
s2423,TV Show,Queer Eye,United States,5-Jun-20,TV-14,Reality TV,
s2424,TV Show,Supernatural,"United States, Canada",5-Jun-20,TV-14,"Classic & Cult TV, TV Action & Adventure, TV Horror",
s2425,Movie,The Last Days of American Crime,United States,5-Jun-20,TV-MA,"Action & Adventure, Dramas, Independent Movies",
s2426,Movie,The Light of My Eyes,,5-Jun-20,TV-MA,"Dramas, International Movies, Romantic Movies",
s2427,TV Show,BAKI,Japan,4-Jun-20,TV-MA,"Anime Series, International TV Shows",
s2428,Movie,Hot Sweet Sour,Turkey,4-Jun-20,TV-14,"Dramas, International Movies, Romantic Movies",
s2429,Movie,Overnight Republic,Turkey,4-Jun-20,TV-MA,"Comedies, International Movies",
s2430,Movie,Can’t Complain,Egypt,3-Jun-20,TV-MA,"Comedies, International Movies, Romantic Movies",
s2431,Movie,Lady Bird,United States,3-Jun-20,R,"Comedies, Dramas, Independent Movies",
s2432,Movie,Spelling the Dream,United States,3-Jun-20,TV-G,"Children & Family Movies, Documentaries",
s2433,TV Show,Alone,,2-Jun-20,TV-14,Reality TV,
s2434,Movie,Andaleeb El Dokki,Egypt,2-Jun-20,TV-14,"Comedies, International Movies",
s2435,Movie,Let's Dance,Egypt,2-Jun-20,TV-14,"Comedies, Dramas, International Movies",
s2436,Movie,Life's Speed Bump,Egypt,2-Jun-20,TV-14,"Comedies, International Movies",
s2437,Movie,Mr. Romantic,,2-Jun-20,TV-14,"Comedies, International Movies, Romantic Movies",
s2438,Movie,My Horrible Grandma,Egypt,2-Jun-20,TV-MA,"Comedies, Dramas, International Movies",
