show_id,type,title,country,released year,rating,listed_in,
s6408,TV Show,Call Me Francis,Italy,16-Dec-16,TV-14,"International TV Shows, Spanish-Language TV Shows, TV Dramas",
s6409,TV Show,Camelia la Texana,"Mexico, United States",1-Feb-17,TV-14,"Crime TV Shows, Romantic TV Shows, Spanish-Language TV Shows",
s6410,Movie,Camera Store,United States,20-Aug-17,TV-MA,"Comedies, Dramas",
s6411,Movie,Camp Cool Kids,United States,1-Jan-18,TV-G,"Children & Family Movies, Comedies, Dramas",
s6412,TV Show,Camp X,Canada,1-Feb-19,TV-MA,Docuseries,
s6413,Movie,Camp X-Ray,United States,14-Jan-17,R,"Dramas, Independent Movies",
s6414,TV Show,Can We Get Married?,South Korea,22-May-17,TV-14,"International TV Shows, Korean TV Shows, Romantic TV Shows",
s6415,Movie,Can't Hardly Wait,United States,1-Jan-21,PG-13,"Comedies, Romantic Movies",
s6416,Movie,Candyman,"United States, United Kingdom",1-Oct-19,R,"Cult Movies, Horror Movies",
s6417,TV Show,Cannabis,France,15-Dec-16,TV-MA,"Crime TV Shows, International TV Shows, TV Dramas",
s6418,Movie,Capital in the Twenty-First Century,"France, New Zealand",8-Sep-20,TV-14,Documentaries,
s6419,Movie,Cappuccino,India,1-Jul-18,TV-PG,"Comedies, Dramas, International Movies",
s6420,Movie,Cardboard Gangsters,Ireland,15-Sep-18,TV-MA,"Dramas, International Movies",
s6421,TV Show,Care Bears: Welcome to Care-a-Lot,United States,2-Aug-19,TV-Y,Kids' TV,
s6422,Movie,Caregiver,Philippines,5-Mar-19,TV-14,"Dramas, International Movies",
s6423,Movie,Carol,"United Kingdom, United States, Australia",20-Oct-20,R,"Dramas, LGBTQ Movies, Romantic Movies",
s6424,Movie,Carrie,United States,1-Jun-19,R,"Classic Movies, Cult Movies, Horror Movies",
s6425,Movie,Carriers,United States,20-Nov-19,PG-13,"Horror Movies, Sci-Fi & Fantasy, Thrillers",
s6426,Movie,Casa de mi Padre,"United States, Mexico",14-Nov-12,R,Comedies,
s6427,TV Show,Case Closed,Japan,4-Jan-19,TV-14,"Anime Series, Crime TV Shows, TV Thrillers",
s6428,Movie,Casino Royale,"United Kingdom, Czech Republic, United States, Germany, Bahamas",31-Aug-20,PG-13,Action & Adventure,
s6429,Movie,Casino Tycoon,Hong Kong,1-Aug-18,TV-MA,"Action & Adventure, Dramas, International Movies",
s6430,Movie,Casino Tycoon 2,Hong Kong,16-Aug-18,TV-MA,"Action & Adventure, Dramas, International Movies",
s6431,TV Show,Castle of Stars,,7-Sep-18,TV-MA,"International TV Shows, Romantic TV Shows, TV Comedies",
s6432,Movie,Cat on a Hot Tin Roof,United States,1-Nov-19,NR,"Classic Movies, Dramas",
s6433,Movie,Catching the Sun,"China, Germany, India, United States",22-Apr-16,TV-14,Documentaries,
s6434,Movie,Cats & Dogs: The Revenge of Kitty Galore,"United States, Australia",1-Feb-19,PG,"Children & Family Movies, Comedies",
s6435,Movie,Catwalk: Tales from the Cat Show Circuit,Canada,7-Jan-19,TV-PG,"Documentaries, International Movies",
s6436,Movie,Cave,Norway,15-Jun-17,TV-MA,"Action & Adventure, International Movies, Thrillers",
s6437,Movie,Celluloid Man,India,1-Apr-17,TV-PG,"Documentaries, International Movies",
s6438,Movie,Center Stage,United States,1-Jan-20,PG-13,Dramas,
s6439,Movie,Chaar Sahibzaade,India,1-Nov-18,TV-PG,"Dramas, Faith & Spirituality, International Movies",
s6440,Movie,Chal Dhar Pakad,India,15-Mar-18,TV-14,"Comedies, Dramas, International Movies",
s6441,Movie,Chal Mere Bhai,India,31-Dec-19,TV-14,"Comedies, International Movies, Romantic Movies",
s6442,Movie,Chalay Thay Saath,Pakistan,15-May-18,TV-14,"Comedies, Dramas, International Movies",
s6443,Movie,Chandani: The Daughter of the Elephant Whisperer,"Germany, Sri Lanka",1-Mar-17,TV-G,"Documentaries, International Movies",
s6444,Movie,Change in the Air,United States,1-Mar-20,PG,Dramas,
s6445,Movie,Chaotic Love Poems,Indonesia,5-Jan-19,TV-14,"Dramas, International Movies, Romantic Movies",
s6446,Movie,Chappaquiddick,"United States, Sweden",1-Oct-18,PG-13,Dramas,
s6447,Movie,Charlie and the Chocolate Factory,"United Kingdom, United States",1-Jan-20,PG,"Children & Family Movies, Comedies",
s6448,Movie,Charlie's Angels: Full Throttle,United States,1-Oct-19,PG-13,"Action & Adventure, Comedies",
s6449,Movie,Charlotte's Web,United States,23-Nov-19,G,"Children & Family Movies, Classic Movies",
s6450,Movie,Chashme Buddoor,India,1-May-17,TV-PG,"Comedies, International Movies, Music & Musicals",
s6451,Movie,Chasing Amy,United States,1-Jan-20,R,"Comedies, Cult Movies, Dramas",
s6452,TV Show,Chasing Monsters,Canada," December 15, 2017",TV-PG,"Docuseries, Reality TV, Science & Nature TV",
s6453,Movie,Chasing the Dragon,"Hong Kong, China",19-Apr-18,TV-MA,"Action & Adventure, Dramas, International Movies",
s6454,Movie,Chasing Trane,United States,13-Nov-17,TV-PG,"Documentaries, Music & Musicals",
s6455,Movie,Chauthi Koot,"India, France",1-Feb-17,TV-14,"Dramas, Independent Movies, International Movies",
s6456,TV Show,Cheapest Weddings,Australia,1-Dec-17,TV-14,"International TV Shows, Reality TV",
s6457,TV Show,Cheers,United States," July 1, 2017",TV-PG,"Classic & Cult TV, TV Comedies",
s6458,TV Show,Chef & My Fridge,South Korea," August 4, 2017",TV-PG,"International TV Shows, Korean TV Shows, Reality TV",
s6459,Movie,Chernobyl Diaries,United States,1-Aug-18,R,"Horror Movies, Thrillers",
s6460,TV Show,Chewin' the Fat,United Kingdom,1-Oct-16,TV-14,"British TV Shows, TV Comedies",
s6461,TV Show,Chewing Gum,United Kingdom," April 4, 2017",TV-MA,"British TV Shows, International TV Shows, Romantic TV Shows",
s6462,Movie,Chhota Bheem Aur Kaala Yodha,,10-May-19,TV-Y7,Movies,
s6463,Movie,Chhota Bheem Ka Romani Adventure,,10-May-19,TV-Y7,Children & Family Movies,
s6464,Movie,Chhota Bheem Ka Troll Se Takkar,,10-May-19,TV-Y7,Movies,
s6465,Movie,Chhota Bheem Kungfu Dhamaka,India,15-Aug-19,TV-Y7,Children & Family Movies,
s6466,Movie,Chicken Kokkachi,India,1-Jul-18,TV-14,"Comedies, International Movies",
s6467,Movie,Chicken Little,United States,16-Mar-16,G,"Children & Family Movies, Comedies",
s6468,Movie,Chief Daddy,Nigeria,15-Mar-19,TV-MA,"Comedies, Dramas, International Movies",
s6469,Movie,Child's Play,United States,31-Dec-19,R,"Cult Movies, Horror Movies",
s6470,TV Show,Chill with Bob Ross,,1-Dec-16,TV-G,TV Shows,
s6471,Movie,China Salesman,China,24-Sep-18,TV-MA,"Action & Adventure, International Movies",
s6472,Movie,Chingo Bling: They Can't Deport Us All,,1-Jun-17,TV-MA,Stand-Up Comedy,
s6473,Movie,Chittagong,"United States, India, Bangladesh",1-Jan-18,NR,"Dramas, Independent Movies, International Movies",
s6474,Movie,Chitty Chitty Bang Bang,"United Kingdom, United States",1-Jan-20,G,"Children & Family Movies, Classic Movies, Comedies",
s6475,Movie,Chloe,"United States, Canada, France",1-Jan-20,R,"Independent Movies, Thrillers",
s6476,Movie,Chris Brown: Welcome to My Life,United States,7-Oct-17,TV-MA,"Documentaries, Music & Musicals",
s6477,Movie,Christian Mingle,United States,6-Jun-19,PG,"Comedies, Faith & Spirituality, Romantic Movies",
s6478,TV Show,Christiane Amanpour: Sex & Love Around the World,United States,30-Sep-18,TV-MA,Docuseries,
s6479,Movie,Christmas Crush,"Canada, United States",4-Nov-19,TV-PG,"Comedies, Romantic Movies",
s6480,Movie,Christmas in the Smokies,United States,1-Mar-19,TV-G,"Children & Family Movies, Dramas, Romantic Movies",
s6481,Movie,Christmas with the Kranks,United States,1-Jan-19,PG,"Children & Family Movies, Comedies",
s6482,Movie,Christopher Robin,United States,5-Mar-19,PG,"Children & Family Movies, Comedies, Dramas",
s6483,Movie,Chronicle of an Escape,Argentina,15-Jun-18,R,"Dramas, International Movies, Thrillers",
s6484,TV Show,Chuck Chicken,Malaysia,15-Nov-17,TV-Y7,Kids' TV,
s6485,Movie,Chupan Chupai,Pakistan,15-Jan-19,TV-14,"Comedies, International Movies",
s6486,Movie,Chupke Chupke,India,31-Dec-19,TV-PG,"Classic Movies, Comedies, International Movies",
s6487,Movie,Cirque du Freak: The Vampire's Assistant,United States,16-Apr-18,PG-13,"Action & Adventure, Horror Movies, Sci-Fi & Fantasy",
s6488,TV Show,City in the Sky,United Kingdom,1-Oct-17,TV-PG,"British TV Shows, Docuseries, Science & Nature TV",
s6489,Movie,City of God,"Brazil, France, Germany",1-Jan-20,R,"Dramas, Independent Movies, International Movies",
s6490,Movie,City of Tiny Lights,United Kingdom,21-Jul-17,TV-MA,"Dramas, International Movies, Thrillers",
s6491,TV Show,Civilizations,United Kingdom,1-Oct-18,TV-14,"British TV Shows, Docuseries",
s6492,Movie,Clarence Clemons: Who Do I Think I Am?,United States,14-Nov-19,TV-MA,"Documentaries, Music & Musicals",
s6493,Movie,Clash of the Titans,"United States, United Kingdom, Australia",1-Aug-19,PG-13,"Action & Adventure, Sci-Fi & Fantasy",
s6494,Movie,Class of '61,United States,1-Apr-18,TV-PG,Dramas,
s6495,Movie,Class Rank,United States,18-Sep-18,TV-MA,Comedies,
s6496,TV Show,Classic Legends,India,15-May-17,TV-PG,"Docuseries, International TV Shows",
s6497,Movie,Cleopatra Jones,United States,1-Nov-19,PG,"Action & Adventure, Classic Movies",
s6498,Movie,Click,United States,1-Jan-20,PG-13,"Comedies, Sci-Fi & Fantasy",
s6499,TV Show,Click for Murder,United Kingdom,17-Sep-17,TV-14,"British TV Shows, Crime TV Shows, Docuseries",
s6500,Movie,Clive Davis: The Soundtrack of Our Lives,United States,17-Sep-19,TV-MA,"Documentaries, Music & Musicals",
s6501,Movie,Closed Circuit,"United Kingdom, United States",16-Oct-17,R,"Dramas, Thrillers",
s6502,Movie,Cloud Atlas,"Germany, United States, Hong Kong, Singapore",1-Aug-17,R,"Action & Adventure, Cult Movies, Dramas",
s6503,Movie,Clouds of Sils Maria,"France, Germany, Switzerland",12-Feb-17,R,"Dramas, International Movies",
s6504,Movie,Cloverfield,United States,1-Jan-20,PG-13,"Action & Adventure, Horror Movies, Sci-Fi & Fantasy",
s6505,TV Show,Club Friday The Series 6,,9-Mar-19,TV-MA,"International TV Shows, Romantic TV Shows, TV Dramas",
s6506,TV Show,Club Friday The Series 7,,18-Jun-18,TV-MA,"International TV Shows, Romantic TV Shows, TV Dramas",
s6507,TV Show,Club Friday The Series 8,,2-Feb-19,TV-MA,"International TV Shows, Romantic TV Shows, TV Comedies",
s6508,TV Show,Club Friday To Be Continued - Friend & Enemy,,20-Apr-18,TV-MA,"International TV Shows, Romantic TV Shows, TV Dramas",
s6509,TV Show,Club Friday To Be Continued - My Beautiful Tomboy,,13-Apr-18,TV-MA,"International TV Shows, Romantic TV Shows, TV Comedies",
s6510,TV Show,Club Friday To Be Continued - The Promise,,20-Apr-18,TV-MA,"International TV Shows, Romantic TV Shows, TV Dramas",
s6511,Movie,Coach Carter,"United States, Germany",1-Jan-20,PG-13,"Dramas, Sports Movies",
s6512,Movie,Code Name: The Cleaner,United States,1-Nov-19,PG-13,"Action & Adventure, Comedies",
s6513,Movie,Coffee with D,India,1-Nov-17,TV-PG,"Comedies, Independent Movies, International Movies",
s6514,TV Show,Cold Case Files,United States,15-Sep-19,TV-14,"Crime TV Shows, Docuseries",
s6515,TV Show,Cold Case Files Classic,United States,15-Sep-20,TV-MA,"Crime TV Shows, Docuseries",
s6516,Movie,Colkatay Columbus,India,30-Mar-17,TV-14,"Comedies, Dramas, Independent Movies",
s6517,Movie,Colonia,"Germany, France, Luxembourg, United Kingdom, United States",14-Jul-18,R,"Dramas, Independent Movies, International Movies",
s6518,Movie,Colours of Passion,India,25-May-18,TV-14,"Dramas, International Movies",
s6519,Movie,Come and Find Me,"Canada, United States, United Kingdom",18-Sep-19,R,"Dramas, Thrillers",
s6520,TV Show,Comedy Bang! Bang!,United States," December 28, 2016",TV-14,"Stand-Up Comedy & Talk Shows, TV Comedies",
s6521,TV Show,Comedy High School,,1-Jul-18,TV-14,"International TV Shows, TV Comedies",
s6522,Movie,Command and Control,United States,15-May-17,TV-PG,Documentaries,
s6523,Movie,Company,India,1-Mar-18,TV-MA,"Action & Adventure, Dramas, International Movies",
s6524,Movie,Compulsion,"United Kingdom, Canada, Italy",4-Oct-18,TV-MA,"Dramas, Thrillers",
s6525,TV Show,Conan Without Borders,United States,31-Dec-18,TV-14,"Docuseries, TV Comedies",
s6526,Movie,Concrete Football,"Czech Republic, France",1-Sep-17,TV-MA,"Documentaries, International Movies, Sports Movies",
s6527,Movie,Concussion,United States,2-Aug-18,R,"Dramas, Independent Movies, LGBTQ Movies",
s6528,Movie,Conjuring Spirit,Vietnam,28-Aug-18,TV-MA,"Horror Movies, International Movies, Thrillers",
s6529,Movie,Conor McGregor: Notorious,Ireland,21-Mar-18,R,"Documentaries, Sports Movies",
s6530,Movie,Consequences ,Turkey,25-Oct-19,TV-MA,"Dramas, International Movies, Thrillers",
s6531,Movie,Contract,India,2-Mar-19,TV-14,"Action & Adventure, Dramas, Independent Movies",
s6532,Movie,Convict,,13-Jun-19,TV-14,"Dramas, International Movies",
s6533,TV Show,Cooking on High,United States,22-Jun-18,TV-MA,Reality TV,
s6534,Movie,Cool Hand Luke,United States,1-Jan-21,TV-14,"Classic Movies, Dramas",
s6535,Movie,Cop and a Half: New Recruit,Canada,17-Aug-17,PG,"Children & Family Movies, Comedies",
s6536,Movie,Cop Watchers,,1-Aug-17,TV-MA,"Documentaries, International Movies",
s6537,Movie,Coraline,United States,16-Mar-17,PG,Children & Family Movies,
s6538,Movie,Counterfeiting in Suburbia,Canada,1-Jul-18,TV-14,"Dramas, Thrillers",
s6539,TV Show,Court Justice,Australia,2-Oct-19,TV-MA,"Crime TV Shows, Docuseries, International TV Shows",
s6540,Movie,Covered: Alive in Asia,United States,31-Mar-16,TV-G,"Documentaries, Faith & Spirituality, Music & Musicals",
s6541,Movie,Crash,"United States, Germany",1-Oct-19,R,"Dramas, Independent Movies",
s6542,Movie,CRD,India,29-Apr-19,TV-MA,"Comedies, Dramas, Independent Movies",
s6543,TV Show,Crime Time,France,31-Jan-19,TV-MA,"Crime TV Shows, International TV Shows, TV Action & Adventure",
s6544,Movie,"Crouching Tiger, Hidden Dragon","Taiwan, Hong Kong, United States, China",1-Mar-19,PG-13,"Action & Adventure, International Movies, Romantic Movies",
s6545,Movie,Cult of Chucky,United States,3-Oct-17,R,Horror Movies,
s6546,Movie,Cutie and the Boxer,United States,14-Jun-18,R,Documentaries,
s6547,Movie,Daagdi Chaawl,India,15-Feb-18,TV-14,"Action & Adventure, Dramas, International Movies",
s6548,Movie,Dabbe 6: The Return,Turkey,17-Apr-19,TV-MA,"Horror Movies, International Movies",
s6549,Movie,Dad,United States,1-Apr-18,PG,Dramas,
s6550,TV Show,Dad's Army,United Kingdom," March 31, 2018",TV-PG,"British TV Shows, Classic & Cult TV, TV Comedies",
s6551,Movie,Daddy Day Care,United States,1-Jan-19,PG,"Children & Family Movies, Comedies",
s6552,Movie,Daddy Issues,United States,20-Sep-19,TV-MA,"Dramas, Independent Movies, LGBTQ Movies",
s6553,Movie,Daemonium,Argentina,20-Dec-16,NR,"Action & Adventure, Horror Movies, International Movies",
s6554,Movie,Daffedar,India,1-Jul-18,TV-14,"Dramas, International Movies",
s6555,Movie,Dagh Ujala,"United States, India",1-Apr-18,TV-MA,"Dramas, Independent Movies, International Movies",
s6556,Movie,Dallas Buyers Club,United States,16-Jan-18,R,"Dramas, Independent Movies, LGBTQ Movies",
s6557,TV Show,Dance Academy,Australia,20-Dec-17,TV-PG,"International TV Shows, Romantic TV Shows, TV Dramas",
s6558,Movie,Dance Academy: The Comeback,"Germany, Australia",2-Jul-18,TV-PG,"Dramas, International Movies",
s6559,Movie,Dancing Quietly,Germany,1-Apr-17,TV-MA,"Dramas, Independent Movies, International Movies",
s6560,TV Show,Dandy,Mexico,31-Mar-18,TV-MA,"Crime TV Shows, International TV Shows, Spanish-Language TV Shows",
s6561,TV Show,Dangerous Roads,United Kingdom," February 1, 2019",TV-MA,"British TV Shows, Docuseries",
s6562,Movie,Danny Says,United States,2-Mar-17,TV-MA,"Documentaries, Music & Musicals",
s6563,Movie,Dante's Peak,United States,1-Sep-19,PG-13,Action & Adventure,
s6564,Movie,Dare to Be Wild,Ireland,1-Apr-18,TV-PG,"Dramas, Independent Movies, Romantic Movies",
s6565,Movie,Dark Chocolate (Bengali Version),India,15-Dec-17,TV-MA,"Dramas, International Movies, Thrillers",
s6566,Movie,Dark Crimes,"United Kingdom, Poland, United States",15-Oct-19,R,"Dramas, Thrillers",
s6567,Movie,Dark Places,"United States, United Kingdom, France",26-Jul-18,R,"Dramas, International Movies, Thrillers",
s6568,Movie,Darna Mana Hai,India,1-Aug-19,TV-MA,"Horror Movies, International Movies, Thrillers",
s6569,TV Show,Darr Sabko Lagta Hai,India,1-Mar-18,TV-MA,"International TV Shows, TV Horror, TV Thrillers",
s6570,Movie,Darra,India,15-Oct-17,TV-14,"Dramas, International Movies",
s6571,Movie,Daughters of the Dust,"United Kingdom, United States",10-Jun-17,NR,"Classic Movies, Dramas, Independent Movies",
s6572,TV Show,Day and Night,China,23-Mar-18,TV-MA,"Crime TV Shows, International TV Shows, TV Dramas",
s6573,TV Show,Days We Stared at the Sun,Taiwan,31-Mar-18,TV-MA,"International TV Shows, TV Dramas",
s6574,Movie,Dayveon,United States,11-Jan-18,TV-MA,"Dramas, Independent Movies",
s6575,Movie,De Film van Dylan Haegens,Netherlands,17-Apr-19,TV-PG,"Comedies, International Movies",
s6576,Movie,De Palma,United States,21-Nov-18,R,Documentaries,
s6577,Movie,Dead in a Week (Or Your Money Back),United Kingdom,1-Mar-19,TV-MA,Comedies,
s6578,Movie,Deadline: Sirf 24 Ghante,India,31-Dec-19,TV-14,"Independent Movies, International Movies, Thrillers",
s6579,Movie,Deadly Scholars,United States,15-Feb-19,TV-14,"Dramas, Thrillers",
s6580,Movie,Dean,United States,15-Mar-20,PG-13,"Comedies, Dramas, Independent Movies",
s6581,Movie,Dear Dad,India,2-Mar-19,TV-14,"Comedies, Dramas, Independent Movies",
s6582,Movie,Dear Dracula,United States,18-Feb-16,TV-Y7-FV,"Children & Family Movies, Comedies",
s6583,Movie,Dear Santa,Canada,4-Nov-19,TV-PG,"Comedies, Romantic Movies",
s6584,Movie,Death at a Funeral,United States,1-Aug-20,R,Comedies,
s6585,Movie,Death House,United States,5-May-19,R,Horror Movies,
s6586,Movie,Deathgrip,United Kingdom,1-Mar-18,TV-MA,"International Movies, Sports Movies",
s6587,TV Show,Deep Undercover Collection,United States,20-Jul-18,TV-MA,"Crime TV Shows, Docuseries",
s6588,TV Show,Deep Water,Australia,1-Jul-17,TV-MA,"Crime TV Shows, International TV Shows, TV Dramas",
s6589,Movie,Deewangee,India,3-Jan-20,TV-MA,"International Movies, Thrillers",
s6590,Movie,Defying the Nazis: The Sharps' War,United States,1-May-17,TV-14,Documentaries,
s6591,Movie,Delirium,United States,1-Sep-18,R,"Horror Movies, Thrillers",
s6592,Movie,Democrats,"Denmark, Zimbabwe",25-Apr-16,NR,"Documentaries, International Movies",
s6593,Movie,Den of Thieves,United States,1-May-20,R,Action & Adventure,
s6594,Movie,Denis Leary: No Cure For Cancer,United States,8-Aug-17,R,Stand-Up Comedy,
s6595,Movie,Desolate,,6-Feb-20,TV-MA,"Dramas, Thrillers",
s6596,Movie,Desolation,United States,8-May-18,TV-MA,"Horror Movies, Thrillers",
s6597,Movie,Detention Letter,Egypt,5-Aug-19,TV-14,"Action & Adventure, International Movies",
s6598,Movie,Detour,"United Kingdom, South Africa",25-May-17,R,Thrillers,
s6599,Movie,Deviant Love,United States,13-Sep-19,TV-14,Thrillers,
s6600,Movie,Devil's Bride,"Finland, Sweden, Norway, Latvia, Germany",1-Jun-17,TV-MA,"Dramas, International Movies",
s6601,Movie,Devil's Gate,Canada,16-Jul-20,TV-MA,"Horror Movies, Sci-Fi & Fantasy, Thrillers",
s6602,TV Show,Devlok with Devdutt Pattanaik,India,15-Oct-18,TV-PG,International TV Shows,
s6603,Movie,Devrai,India,1-Jan-18,TV-PG,"Dramas, International Movies",
s6604,TV Show,Dexter,United States," January 1, 2018",TV-MA,"Crime TV Shows, TV Dramas, TV Mysteries",
s6605,Movie,Dhamaal,India,31-Dec-19,TV-14,"Action & Adventure, Comedies, International Movies",
s6606,Movie,Di Renjie zhi Sidatianwang,"China, Hong Kong",6-Feb-19,TV-14,"Action & Adventure, International Movies, Sci-Fi & Fantasy",
s6607,Movie,Diana: 7 Days That Shook the World,United Kingdom,28-Jul-17,TV-PG,Documentaries,
s6608,Movie,Diana: In Her Own Words,United Kingdom,1-Dec-17,TV-PG,"Documentaries, International Movies",
s6609,Movie,Diary of a Chambermaid,"France, Belgium",3-Dec-16,NR,"Dramas, International Movies",
s6610,Movie,Die Another Day,"United Kingdom, United States",31-Dec-19,PG-13,Action & Adventure,
s6611,Movie,Dil Hai Tumhaara,India,1-Apr-18,TV-14,"Dramas, International Movies, Music & Musicals",
s6612,TV Show,Dinner for Five,United States,4-Feb-08,TV-MA,Stand-Up Comedy & Talk Shows,
s6613,Movie,Dinner for Schmucks,United States,1-Jan-20,PG-13,Comedies,
s6614,TV Show,Dino Hunt,Canada,4-Aug-17,TV-G,"Docuseries, Science & Nature TV",
s6615,Movie,Disciples Of The 36th Chamber,Hong Kong,16-Aug-18,TV-14,"Action & Adventure, International Movies",
s6616,Movie,Discovering Bigfoot,United States,15-Dec-17,TV-MA,Documentaries,
s6617,Movie,Dismissed,United States,19-Feb-18,TV-14,Thrillers,
s6618,Movie,District 9,"South Africa, United States, New Zealand, Canada",4-Nov-19,R,"Action & Adventure, International Movies, Sci-Fi & Fantasy",
s6619,TV Show,Diva Brides,,2-Oct-19,TV-MA,"British TV Shows, Reality TV",
s6620,Movie,Doctor Zhivago,"United States, Italy, United Kingdom, Liechtenstein",1-Nov-19,PG-13,"Classic Movies, Dramas, Romantic Movies",
s6621,Movie,Dog Eat Dog,United States,31-Dec-16,TV-MA,"Dramas, Thrillers",
s6622,Movie,Dolphin Kick,United States,5-Jun-19,TV-PG,Children & Family Movies,
s6623,Movie,Dolphin Tale 2,United States,25-Feb-19,PG,"Children & Family Movies, Dramas",
s6624,Movie,Domino,"Denmark, France, Belgium, Italy, Netherlands, United States, United Kingdom",28-Sep-19,R,"International Movies, Thrillers",
s6625,Movie,Don Quixote: The Ingenious Gentleman of La Mancha,United States,5-Jan-18,TV-14,"Comedies, Independent Movies",
s6626,Movie,Don Verdean,United States,1-Mar-20,PG-13,Comedies,
s6627,Movie,Don't Be Afraid of the Dark,"United States, Australia, Mexico",2-Nov-19,R,Horror Movies,
s6628,Movie,Don't Crack Under Pressure,France,12-Jun-20,TV-MA,"Action & Adventure, Documentaries, International Movies",
s6629,Movie,Don't Crack Under Pressure II,France,12-Jun-20,TV-MA,"Action & Adventure, Documentaries, International Movies",
s6630,Movie,Don't Crack Under Pressure III,France,12-Jun-20,TV-14,"Action & Adventure, Documentaries, International Movies",
s6631,Movie,Don't Knock Twice,United Kingdom,8-Feb-19,R,"Horror Movies, International Movies",
s6632,Movie,Don't Look Down,United Kingdom,1-Apr-17,TV-MA,"Documentaries, International Movies",
s6633,Movie,Don't Think Twice,United States,1-May-17,R,"Comedies, Dramas, Independent Movies",
s6634,Movie,Donnie Brasco,United States,1-Jan-20,R,"Dramas, Thrillers",
s6635,Movie,Doom,"United Kingdom, Czech Republic, Germany, United States",1-Nov-20,R,"Action & Adventure, Horror Movies, Sci-Fi & Fantasy",
s6636,TV Show,Doomsday Preppers,United States,1-Mar-19,TV-14,"Reality TV, Science & Nature TV",
s6637,Movie,Doubles Cause Troubles,Hong Kong,1-Aug-18,TV-14,"Action & Adventure, Comedies, International Movies",
s6638,Movie,Doubt,United States,7-Mar-19,PG-13,"Dramas, Faith & Spirituality",
s6639,Movie,Down The Fence,United States,15-Jan-18,TV-PG,Documentaries,
s6640,Movie,Dr. Seuss' The Cat in the Hat,United States,1-May-19,PG,"Children & Family Movies, Comedies",
s6641,Movie,Dr. Seuss' The Grinch,"France, China, Japan, United States",5-Jun-19,PG,"Children & Family Movies, Comedies",
s6642,Movie,Dragonheart,United States,1-Jan-20,PG-13,"Action & Adventure, Sci-Fi & Fantasy",
s6643,Movie,Dragonheart 3: The Sorcerer,United States,1-Jan-20,PG-13,"Action & Adventure, Sci-Fi & Fantasy",
s6644,Movie,Dragonheart: A New Beginning,United States,1-Jan-20,PG,"Action & Adventure, Sci-Fi & Fantasy",
s6645,Movie,Dragonheart: Battle for the Heartfire,United States,13-Jun-17,PG-13,"Action & Adventure, Sci-Fi & Fantasy",
s6646,Movie,Dragonkala Ka Rahasya,,18-Jun-19,TV-Y,Children & Family Movies,
s6647,TV Show,Dramaworld,"United States, South Korea, China",23-May-16,TV-14,"Romantic TV Shows, TV Comedies, TV Dramas",
s6648,Movie,Dream Big: Engineering Our World,United States,1-Jul-18,TV-G,Documentaries,
s6649,Movie,Dream Boat,Germany,1-Dec-17,TV-MA,"Documentaries, International Movies, LGBTQ Movies",
s6650,Movie,Dries,"Germany, Belgium",1-Jan-18,TV-PG,"Documentaries, International Movies",
s6651,Movie,Driven to Dance,United States,16-Jan-19,TV-PG,Dramas,
s6652,TV Show,"Drugs, Inc.",United States,23-Mar-19,TV-MA,"Crime TV Shows, Docuseries",
s6653,TV Show,Dueños del paraíso,"United States, Chile",25-Feb-17,TV-14,"Crime TV Shows, International TV Shows, Spanish-Language TV Shows",
s6654,Movie,Dukhtar,"Pakistan, Norway, United States",1-Sep-16,TV-14,"Dramas, Independent Movies, International Movies",
s6655,Movie,Dum,India,1-Mar-18,TV-14,"Action & Adventure, Dramas, International Movies",
s6656,Movie,Dumb and Dumberer: When Harry Met Lloyd,United States,1-Oct-19,PG-13,Comedies,
s6657,Movie,E-Cigarettes: Miracle or Menace?,United Kingdom,1-Feb-19,TV-14,Documentaries,
s6658,Movie,Earth to Echo,United States,1-Oct-19,PG,"Children & Family Movies, Sci-Fi & Fantasy",
s6659,TV Show,Earth to Luna!,Brazil,10-Apr-20,TV-Y,Kids' TV,
s6660,TV Show,Earth's Natural Wonders,United Kingdom,1-Mar-17,TV-PG,"British TV Shows, Docuseries, Science & Nature TV",
s6661,TV Show,Earth's Natural Wonders: Life at the Extremes,,1-Oct-18,TV-14,"British TV Shows, Docuseries, Science & Nature TV",
s6662,Movie,East Side Sushi,United States,15-Sep-20,PG,Dramas,
s6663,Movie,Easy A,United States,1-Nov-20,PG-13,"Comedies, Romantic Movies",
s6664,TV Show,Easy Fortune Happy Life,Taiwan,1-Sep-16,TV-MA,"International TV Shows, Romantic TV Shows, TV Comedies",
s6665,Movie,Eat Pray Love,United States,10-Sep-19,PG-13,"Dramas, Romantic Movies",
s6666,Movie,Eddie Murphy: Delirious,United States,15-Apr-18,TV-MA,Stand-Up Comedy,
s6667,Movie,Eeda,India,15-Sep-18,TV-14,"Dramas, International Movies, Romantic Movies",
s6668,Movie,Eh Janam Tumhare Lekhe,India,1-Dec-17,TV-14,"Dramas, International Movies",
s6669,Movie,Ek Cup Chya,India,15-Mar-18,TV-PG,"Dramas, Independent Movies, International Movies",
s6670,Movie,Ek Hasina Thi,India,1-Aug-19,TV-MA,"Dramas, International Movies, Thrillers",
s6671,Movie,El último testigo,"United States, Canada, Belgium, United Kingdom",4-Feb-18,R,Action & Adventure,
s6672,TV Show,El Barco,Spain," July 1, 2017",NR,"International TV Shows, Romantic TV Shows, Spanish-Language TV Shows",
